product_slug,image_path,is_main,sort_order,alt
dior-pure-poison,import_images/dior-pure-poison/1.avif,1,1,Dior Pure Poison фото 1
dior-sauvage-eau-de-parfum,import_images/dior-sauvage-eau-de-parfum/1.avif,1,1,Dior Sauvage Eau de Parfum фото 1
dior-sauvage-elixir,import_images/dior-sauvage-elixir/1.avif,1,1,Dior Sauvage Elixir фото 1
dior-sauvage-parfum,import_images/dior-sauvage-parfum/1.avif,1,1,Dior Sauvage Parfum фото 1
dior-vanilla-diorama,import_images/dior-vanilla-diorama/1.avif,1,1,Dior Vanilla Diorama фото 1
dukhi-amouage-guidance-46,import_images/dukhi-amouage-guidance-46/1.avif,1,1,Amouage Guidance 46 фото 1
dukhi-byredo-animalique,import_images/dukhi-byredo-animalique/1.avif,1,1,Byredo Animalique фото 1
dukhi-byredo-cuir-obscur,import_images/dukhi-byredo-cuir-obscur/1.avif,1,1,Byredo Cuir Obscur фото 1
dukhi-byredo-rouge-chaotique,import_images/dukhi-byredo-rouge-chaotique/1.avif,1,1,Byredo Rouge Chaotique фото 1
dukhi-clive-christian-town-country,import_images/dukhi-clive-christian-town-country/1.avif,1,1,Clive Christian Town & Country фото 1
dukhi-essential-parfums-patchouli-mania,import_images/dukhi-essential-parfums-patchouli-mania/1.avif,1,1,Essential Parfums Patchouli Mania фото 1
dukhi-ex-nihilo-chandigarh-express,import_images/dukhi-ex-nihilo-chandigarh-express/1.avif,1,1,Ex Nihilo Chandigarh Express фото 1
dukhi-ex-nihilo-fleur-narcotique-10-years-limited-edition,import_images/dukhi-ex-nihilo-fleur-narcotique-10-years-limited-edition/1.avif,1,1,Ex Nihilo Fleur Narcotique 10 Years Limited Edition фото 1
dukhi-ex-nihilo-gold-immortals-musc,import_images/dukhi-ex-nihilo-gold-immortals-musc/1.avif,1,1,Ex Nihilo Gold Immortals Musc фото 1
dukhi-ex-nihilo-the-hedonist-extrait-de-parfum,import_images/dukhi-ex-nihilo-the-hedonist-extrait-de-parfum/1.avif,1,1,Ex Nihilo The Hedonist Extrait de Parfum фото 1
dukhi-frederic-malle-the-moon,import_images/dukhi-frederic-malle-the-moon/1.avif,1,1,Frederic Malle The Moon фото 1
dukhi-giorgio-armani-emporio-armani-stronger-with-you-amber,import_images/dukhi-giorgio-armani-emporio-armani-stronger-with-you-amber/1.avif,1,1,Giorgio Armani Emporio Armani Stronger With You Amber фото 1
dukhi-kajal-aican,import_images/dukhi-kajal-aican/1.avif,1,1,Kajal Aican фото 1
dukhi-louis-vuitton-on-the-beach,import_images/dukhi-louis-vuitton-on-the-beach/1.avif,1,1,Louis Vuitton On The Beach фото 1
dukhi-louis-vuitton-stellar-times,import_images/dukhi-louis-vuitton-stellar-times/1.avif,1,1,Louis Vuitton Stellar Times фото 1
dukhi-louis-vuitton-symphony,import_images/dukhi-louis-vuitton-symphony/1.avif,1,1,Louis Vuitton Symphony фото 1
dukhi-marc-antoine-barrois-tilia,import_images/dukhi-marc-antoine-barrois-tilia/1.avif,1,1,Marc-Antoine Barrois Tilia фото 1
dukhi-roja-dove-isola-blu,import_images/dukhi-roja-dove-isola-blu/1.avif,1,1,Roja Dove Isola Blu фото 1
dukhi-roja-dove-manhattan-eau-de-parfum,import_images/dukhi-roja-dove-manhattan-eau-de-parfum/1.avif,1,1,Roja Dove Manhattan Eau de Parfum фото 1
dukhi-tom-ford-soleil-neige-parfum,import_images/dukhi-tom-ford-soleil-neige-parfum/1.avif,1,1,Tom Ford Soleil Neige Parfum фото 1
dukhi-tom-ford-vanille-fatale-2024,import_images/dukhi-tom-ford-vanille-fatale-2024/1.avif,1,1,Tom Ford Vanille Fatale 2024 фото 1
dukhi-xerjoff-starlight,import_images/dukhi-xerjoff-starlight/1.avif,1,1,Xerjoff Starlight фото 1
dukhi-xerjoff-tony-iommi-monkey-special,import_images/dukhi-xerjoff-tony-iommi-monkey-special/1.avif,1,1,Xerjoff Tony Iommi Monkey Special фото 1
dukhi-xerjoff-torino22,import_images/dukhi-xerjoff-torino22/1.avif,1,1,Xerjoff Torino22 фото 1
emporio-armani-diamonds,import_images/emporio-armani-diamonds/1.avif,1,1,Emporio Armani Diamonds фото 1
emporio-armani-diamonds-black-carat,import_images/emporio-armani-diamonds-black-carat/1.avif,1,1,Emporio Armani Diamonds Black Carat фото 1
emporio-armani-diamonds-for-men,import_images/emporio-armani-diamonds-for-men/1.avif,1,1,Emporio Armani Diamonds For Men фото 1
emporio-armani-diamonds-intense,import_images/emporio-armani-diamonds-intense/1.avif,1,1,Emporio Armani Diamonds Intense фото 1
emporio-armani-diamonds-rose,import_images/emporio-armani-diamonds-rose/1.avif,1,1,Emporio Armani Diamonds Rose фото 1
emporio-armani-diamonds-violet,import_images/emporio-armani-diamonds-violet/1.avif,1,1,Emporio Armani Diamonds Violet фото 1
escentric-molecules-escentric-02-extrait,import_images/escentric-molecules-escentric-02-extrait/1.avif,1,1,Escentric Molecules Escentric 02 Extrait фото 1
escentric-molecules-kinski,import_images/escentric-molecules-kinski/1.avif,1,1,Escentric Molecules Kinski фото 1
escentric-molecules-molecule-01-champaca,import_images/escentric-molecules-molecule-01-champaca/1.avif,1,1,Escentric Molecules Molecule 01 + Champaca фото 1
escentric-molecules-molecule-01-cistus,import_images/escentric-molecules-molecule-01-cistus/1.avif,1,1,Escentric Molecules Molecule 01 + Cistus фото 1
essential-parfums-divine-vanille,import_images/essential-parfums-divine-vanille/1.avif,1,1,Essential Parfums Divine Vanille фото 1
essential-parfums-fig-infusion,import_images/essential-parfums-fig-infusion/1.avif,1,1,Essential Parfums Fig Infusion фото 1
essential-parfums-mon-vetiver,import_images/essential-parfums-mon-vetiver/1.avif,1,1,Essential Parfums Mon Vetiver фото 1
essential-parfums-nice-bergamote,import_images/essential-parfums-nice-bergamote/1.avif,1,1,Essential Parfums Nice Bergamote фото 1
essential-parfums-orange-x-santal,import_images/essential-parfums-orange-x-santal/1.avif,1,1,Essential Parfums Orange X Santal фото 1
essential-parfums-rose-magnetic,import_images/essential-parfums-rose-magnetic/1.avif,1,1,Essential Parfums Rose Magnetic фото 1
essential-parfums-the-musc,import_images/essential-parfums-the-musc/1.avif,1,1,Essential Parfums The Musc фото 1
essential-parfumsm-bois-imprial-extrait,import_images/essential-parfumsm-bois-imprial-extrait/1.avif,1,1,Essential Parfums Bois Impérial Extrait фото 1
ex-nihilo-atlas-fever,import_images/ex-nihilo-atlas-fever/1.avif,1,1,Ex Nihilo Atlas Fever фото 1
ex-nihilo-blue-talisman,import_images/ex-nihilo-blue-talisman/1.avif,1,1,Ex Nihilo Blue Talisman фото 1
ex-nihilo-blue-talisman-extrait-de-parfum,import_images/ex-nihilo-blue-talisman-extrait-de-parfum/1.avif,1,1,Ex Nihilo Blue Talisman Extrait de Parfum фото 1
ex-nihilo-cologne-352,import_images/ex-nihilo-cologne-352/1.avif,1,1,Ex Nihilo Cologne 352 фото 1
ex-nihilo-devil-tender,import_images/ex-nihilo-devil-tender/1.avif,1,1,Ex Nihilo Devil Tender фото 1
ex-nihilo-explicite,import_images/ex-nihilo-explicite/1.avif,1,1,Ex Nihilo Explicite фото 1
ex-nihilo-fleur-narcotique,import_images/ex-nihilo-fleur-narcotique/1.avif,1,1,Ex Nihilo Fleur Narcotique фото 1
ex-nihilo-fleur-narcotique-blossom,import_images/ex-nihilo-fleur-narcotique-blossom/1.avif,1,1,Ex Nihilo Fleur Narcotique Blossom фото 1
ex-nihilo-fleur-narcotique-extrait-de-parfum,import_images/ex-nihilo-fleur-narcotique-extrait-de-parfum/1.avif,1,1,Ex Nihilo Fleur Narcotique Extrait de Parfum фото 1
ex-nihilo-fleur-narcotique-love-edition,import_images/ex-nihilo-fleur-narcotique-love-edition/1.avif,1,1,Ex Nihilo Fleur Narcotique Love Edition фото 1
ex-nihilo-fleur-narcotique-musc,import_images/ex-nihilo-fleur-narcotique-musc/1.avif,1,1,Ex Nihilo Fleur Narcotique Signature Musc фото 1
ex-nihilo-gold-immortals,import_images/ex-nihilo-gold-immortals/1.avif,1,1,Ex Nihilo Gold Immortals фото 1
ex-nihilo-gold-immortals-extrait-de-parfum,import_images/ex-nihilo-gold-immortals-extrait-de-parfum/1.avif,1,1,Ex Nihilo Gold Immortals Extrait de Parfum фото 1
ex-nihilo-jasmin-fauve,import_images/ex-nihilo-jasmin-fauve/1.avif,1,1,Ex Nihilo Jasmin Fauve фото 1
ex-nihilo-lust-in-paradise,import_images/ex-nihilo-lust-in-paradise/1.avif,1,1,Ex Nihilo Lust In Paradise фото 1
ex-nihilo-lust-in-paradise-par-reine-paradis,import_images/ex-nihilo-lust-in-paradise-par-reine-paradis/1.avif,1,1,Ex Nihilo Lust In Paradise Par Reine Paradis фото 1
ex-nihilo-midnight-special,import_images/ex-nihilo-midnight-special/1.avif,1,1,Ex Nihilo Midnight Special фото 1
ex-nihilo-musc-infini,import_images/ex-nihilo-musc-infini/1.avif,1,1,Ex Nihilo Musc Infini фото 1
ex-nihilo-rose-hubris,import_images/ex-nihilo-rose-hubris/1.avif,1,1,Ex Nihilo Rose Hubris фото 1
ex-nihilo-santal-calling,import_images/ex-nihilo-santal-calling/1.avif,1,1,Ex Nihilo Santal Calling фото 1
ex-nihilo-sweet-morphine,import_images/ex-nihilo-sweet-morphine/1.avif,1,1,Ex Nihilo Sweet Morphine фото 1
ex-nihilo-the-hedonist,import_images/ex-nihilo-the-hedonist/1.avif,1,1,Ex Nihilo The Hedonist фото 1
ex-nihilo-the-hedonist-musc,import_images/ex-nihilo-the-hedonist-musc/1.avif,1,1,Ex Nihilo The Hedonist Musc фото 1
ex-nihilo-venenum-kiss,import_images/ex-nihilo-venenum-kiss/1.avif,1,1,Ex Nihilo Venenum Kiss фото 1
ex-nihilo-venenum-kiss-rose-de-mai,import_images/ex-nihilo-venenum-kiss-rose-de-mai/1.avif,1,1,EX Nihilo Venenum Kiss Rose De Mai фото 1
ex-nihilo-vetiver-moloko,import_images/ex-nihilo-vetiver-moloko/1.avif,1,1,Ex Nihilo Vetiver Moloko фото 1
ex-nihilo-viper-green,import_images/ex-nihilo-viper-green/1.avif,1,1,Ex Nihilo Viper Green фото 1
franck-boclet-ashes,import_images/franck-boclet-ashes/1.avif,1,1,Franck Boclet Ashes фото 1
franck-boclet-cocaine,import_images/franck-boclet-cocaine/1.avif,1,1,Franck Boclet Cocaine фото 1
franck-boclet-geranium,import_images/franck-boclet-geranium/1.avif,1,1,Franck Boclet Geranium фото 1
franck-boclet-incense,import_images/franck-boclet-incense/1.avif,1,1,Franck Boclet Incense фото 1
franck-boclet-just,import_images/franck-boclet-just/1.avif,1,1,Franck Boclet Just фото 1
franck-boclet-oud,import_images/franck-boclet-oud/1.avif,1,1,Franck Boclet Oud фото 1
franck-boclet-patchouli,import_images/franck-boclet-patchouli/1.avif,1,1,Franck Boclet Patchouli фото 1
franck-boclet-sugar,import_images/franck-boclet-sugar/1.avif,1,1,Franck Boclet Sugar фото 1
franck-boclet-tonka,import_images/franck-boclet-tonka/1.avif,1,1,Franck Boclet Tonka фото 1
franck-boclet-vanille,import_images/franck-boclet-vanille/1.avif,1,1,Franck Boclet Vanille фото 1
franck-boclet-vetiver,import_images/franck-boclet-vetiver/1.avif,1,1,Franck Boclet Vetiver фото 1
franck-boclet-violet,import_images/franck-boclet-violet/1.avif,1,1,Franck Boclet Violet фото 1
frederic-malle-bigarade-concentree,import_images/frederic-malle-bigarade-concentree/1.avif,1,1,Frederic Malle Bigarade Concentree фото 1
frederic-malle-carnal-flowerr,import_images/frederic-malle-carnal-flowerr/1.avif,1,1,Frederic Malle Carnal Flower фото 1
frederic-malle-dans-tes-bras,import_images/frederic-malle-dans-tes-bras/1.avif,1,1,Frederic Malle Dans Tes Bras фото 1
frederic-malle-dawn,import_images/frederic-malle-dawn/1.avif,1,1,Frederic Malle Dawn фото 1
frederic-malle-eau-de-magnolia,import_images/frederic-malle-eau-de-magnolia/1.avif,1,1,Frederic Malle Eau de Magnolia фото 1
frederic-malle-french-loverr,import_images/frederic-malle-french-loverr/1.avif,1,1,Frederic Malle French Lover фото 1
frederic-malle-geranium-pour-monsieurr,import_images/frederic-malle-geranium-pour-monsieurr/1.avif,1,1,Frederic Malle Geranium Pour Monsieur фото 1
frederic-malle-iris-poudree,import_images/frederic-malle-iris-poudree/1.avif,1,1,Frederic Malle Iris Poudre фото 1
frederic-malle-lipstick-rose,import_images/frederic-malle-lipstick-rose/1.avif,1,1,Frederic Malle Lipstick Rose фото 1
frederic-malle-lys-mediterranee,import_images/frederic-malle-lys-mediterranee/1.avif,1,1,Frederic Malle Lys Mediterranee фото 1
frederic-malle-monsieur,import_images/frederic-malle-monsieur/1.avif,1,1,Frederic Malle Monsieur фото 1
frederic-malle-musc-ravageurr,import_images/frederic-malle-musc-ravageurr/1.avif,1,1,Frederic Malle Musc Ravageur фото 1
frederic-malle-music-for-a-while,import_images/frederic-malle-music-for-a-while/1.avif,1,1,Frederic Malle Music For a While фото 1
frederic-malle-passant,import_images/frederic-malle-passant/1.avif,1,1,Frederic Malle En Passant фото 1
frederic-malle-portrait-of-lady,import_images/frederic-malle-portrait-of-lady/1.avif,1,1,Frederic Malle Portrait of a Lady фото 1
frederic-malle-promise1,import_images/frederic-malle-promise1/1.avif,1,1,Frederic Malle Promise фото 1
frederic-malle-rose-cuir,import_images/frederic-malle-rose-cuir/1.avif,1,1,Frederic Malle Rose & Cuir фото 1
frederic-malle-the-night,import_images/frederic-malle-the-night/1.avif,1,1,Frederic Malle The Night фото 1
frederic-malle-vetiver-extraordinaire,import_images/frederic-malle-vetiver-extraordinaire/1.avif,1,1,Frederic Malle Vetiver Extraordinaire фото 1
genyum-painter,import_images/genyum-painter/1.avif,1,1,Genyum Painter фото 1
giorgio-armani-armani-code-absolu-gold,import_images/giorgio-armani-armani-code-absolu-gold/1.avif,1,1,Giorgio Armani Armani Code Absolu Gold фото 1
giorgio-armani-armani-code-absolu-pour-femme,import_images/giorgio-armani-armani-code-absolu-pour-femme/1.avif,1,1,Giorgio Armani Armani Code Absolu Pour Femme фото 1
giorgio-armani-armani-code-eau-de-parfum,import_images/giorgio-armani-armani-code-eau-de-parfum/1.avif,1,1,Giorgio Armani Armani Code Eau de Parfum фото 1
giorgio-armani-code-absolu,import_images/giorgio-armani-code-absolu/1.avif,1,1,Giorgio Armani Code Absolu фото 1
giorgio-armani-code-luna-sensuelle,import_images/giorgio-armani-code-luna-sensuelle/1.avif,1,1,Giorgio Armani Code Luna sensuelle фото 1
giorgio-armani-code-profumo,import_images/giorgio-armani-code-profumo/1.avif,1,1,Giorgio Armani Code Profumo фото 1
giorgio-armani-mania-pour-homme,import_images/giorgio-armani-mania-pour-homme/1.avif,1,1,Giorgio Armani Mania pour Homme фото 1
giorgio-armani-my-way,import_images/giorgio-armani-my-way/1.avif,1,1,Giorgio Armani My Way фото 1
giorgio-armani-my-way-floral,import_images/giorgio-armani-my-way-floral/1.avif,1,1,Giorgio Armani My Way Floral фото 1
giorgio-armani-my-way-intense,import_images/giorgio-armani-my-way-intense/1.avif,1,1,Giorgio Armani My Way Intense фото 1
giorgio-armani-sensi,import_images/giorgio-armani-sensi/1.avif,1,1,Giorgio Armani Sensi фото 1
giorgio-armani-sensi-white-notes,import_images/giorgio-armani-sensi-white-notes/1.avif,1,1,Giorgio Armani Sensi White Notes фото 1
giorgio-armani-stronger-with-you,import_images/giorgio-armani-stronger-with-you/1.avif,1,1,Giorgio Armani  Stronger With You фото 1
giorgio-armani-stronger-with-you-absolutely,import_images/giorgio-armani-stronger-with-you-absolutely/1.avif,1,1,Giorgio Armani Stronger With You Absolutely фото 1
giorgio-armani-stronger-with-you-freeze-men,import_images/giorgio-armani-stronger-with-you-freeze-men/1.avif,1,1,Giorgio Armani Stronger With You Freeze men фото 1
giorgio-armani-stronger-with-you-intensely,import_images/giorgio-armani-stronger-with-you-intensely/1.avif,1,1,Giorgio Armani Stronger With You Intensely фото 1
giorgio-armani-stronger-with-you-only,import_images/giorgio-armani-stronger-with-you-only/1.avif,1,1,Giorgio Armani Stronger With You Only фото 1
giorgio-armani-stronger-with-you-oud,import_images/giorgio-armani-stronger-with-you-oud/1.avif,1,1,Giorgio Armani Stronger With You Oud фото 1
givenchy-amarige,import_images/givenchy-amarige/1.avif,1,1,Givenchy Amarige фото 1
givenchy-amarige-damour,import_images/givenchy-amarige-damour/1.avif,1,1,Givenchy Amarige D`Amour фото 1
givenchy-amarige-mariage,import_images/givenchy-amarige-mariage/1.avif,1,1,Givenchy Amarige Mariage фото 1
givenchy-ange-ou-demon,import_images/givenchy-ange-ou-demon/1.avif,1,1,Givenchy Ange Ou Demon фото 1
givenchy-ange-ou-demon-le-parfum-accord-illicite,import_images/givenchy-ange-ou-demon-le-parfum-accord-illicite/1.avif,1,1,Givenchy Ange ou Demon Le Parfum Accord Illicite фото 1
givenchy-ange-ou-demon-le-secret,import_images/givenchy-ange-ou-demon-le-secret/1.avif,1,1,Givenchy Ange Ou Demon Le Secret edP фото 1
givenchy-ange-ou-demon-le-secret-eau-de-toilette,import_images/givenchy-ange-ou-demon-le-secret-eau-de-toilette/1.avif,1,1,Givenchy Ange Ou Demon Le Secret edT фото 1
givenchy-ange-ou-demon-le-secret-edition-croisiere,import_images/givenchy-ange-ou-demon-le-secret-edition-croisiere/1.avif,1,1,Givenchy Ange Ou Demon Le Secret Edition Croisiere фото 1
givenchy-ange-ou-demon-le-secret-elixir,import_images/givenchy-ange-ou-demon-le-secret-elixir/1.avif,1,1,Givenchy Ange Ou Demon Le Secret Elixir фото 1
givenchy-ange-ou-demon-le-secret-poesie-dun-parfum-dhiver-edition,import_images/givenchy-ange-ou-demon-le-secret-poesie-dun-parfum-dhiver-edition/1.avif,1,1,Givenchy Ange Ou Demon Le Secret Poesie D`un Parfum D`Hiver edition фото 1
givenchy-ange-ou-demon-tendre,import_images/givenchy-ange-ou-demon-tendre/1.avif,1,1,Givenchy Ange Ou Demon Tendre фото 1
givenchy-dahlia-divin,import_images/givenchy-dahlia-divin/1.avif,1,1,Givenchy Dahlia Divin фото 1
givenchy-dahlia-divin-eau-de-parfum-nude,import_images/givenchy-dahlia-divin-eau-de-parfum-nude/1.avif,1,1,Givenchy Dahlia Divin Eau de Parfum Nude фото 1
givenchy-dahlia-divin-eau-de-toilette,import_images/givenchy-dahlia-divin-eau-de-toilette/1.avif,1,1,Givenchy Dahlia Divin Eau de Toilette фото 1
givenchy-dahlia-divin-eau-initiale,import_images/givenchy-dahlia-divin-eau-initiale/1.avif,1,1,Givenchy Dahlia Divin Eau Initiale фото 1
givenchy-dahlia-divin-le-nectar-de-parfum,import_images/givenchy-dahlia-divin-le-nectar-de-parfum/1.avif,1,1,Givenchy Dahlia Divin Le Nectar de Parfum фото 1
givenchy-eau-de-givenchy,import_images/givenchy-eau-de-givenchy/1.avif,1,1,Givenchy Eau De Givenchy фото 1
givenchy-eau-de-givenchy-rose,import_images/givenchy-eau-de-givenchy-rose/1.avif,1,1,Givenchy Eau de Givenchy Rosée фото 1
givenchy-extravagance-damarige,import_images/givenchy-extravagance-damarige/1.avif,1,1,Givenchy Extravagance d'Amarige фото 1
givenchy-gentleman-eau-de-parfum,import_images/givenchy-gentleman-eau-de-parfum/1.avif,1,1,Givenchy Gentleman Eau De Parfum фото 1
givenchy-gentleman-eau-de-parfum-boisee,import_images/givenchy-gentleman-eau-de-parfum-boisee/1.avif,1,1,Givenchy Gentleman Eau de Parfum Boisee фото 1
givenchy-gentleman-eau-de-parfum-reserve-prive,import_images/givenchy-gentleman-eau-de-parfum-reserve-prive/1.avif,1,1,Givenchy Gentleman Eau de Parfum Reserve Privée фото 1
givenchy-gentleman-society,import_images/givenchy-gentleman-society/1.avif,1,1,Givenchy Gentleman Society фото 1
givenchy-gentlemen-only,import_images/givenchy-gentlemen-only/1.avif,1,1,Givenchy Gentlemen Only фото 1
givenchy-gentlemen-only-absolute,import_images/givenchy-gentlemen-only-absolute/1.avif,1,1,Givenchy Gentlemen Only Absolute фото 1
givenchy-gentlemen-only-casual-chic,import_images/givenchy-gentlemen-only-casual-chic/1.avif,1,1,Givenchy Gentlemen Only Casual Chic фото 1
givenchy-gentlemen-only-intense,import_images/givenchy-gentlemen-only-intense/1.avif,1,1,Givenchy Gentlemen Only Intense фото 1
givenchy-irresistible,import_images/givenchy-irresistible/1.avif,1,1,Givenchy Irresistible фото 1
givenchy-irresistible-eau-de-toilette-fraiche,import_images/givenchy-irresistible-eau-de-toilette-fraiche/1.avif,1,1,Givenchy Irresistible Eau De Toilette Fraiche фото 1
givenchy-live-irresistible,import_images/givenchy-live-irresistible/1.avif,1,1,Givenchy  Live Irresistible фото 1
givenchy-live-irresistible-blossom-crush,import_images/givenchy-live-irresistible-blossom-crush/1.avif,1,1,Givenchy Live Irresistible Blossom Crush фото 1
givenchy-live-irresistible-eau-de-toilette,import_images/givenchy-live-irresistible-eau-de-toilette/1.avif,1,1,Givenchy Live Irresistible Eau de Toilette фото 1
givenchy-live-irresistible-rosy-crush,import_images/givenchy-live-irresistible-rosy-crush/1.avif,1,1,Givenchy Live Irresistible Rosy Crush фото 1
givenchy-organza,import_images/givenchy-organza/1.avif,1,1,Givenchy Organza фото 1
givenchy-organza-indecence,import_images/givenchy-organza-indecence/1.avif,1,1,Givenchy Organza Indecence фото 1
givenchy-pi,import_images/givenchy-pi/1.avif,1,1,Givenchy Pi фото 1
givenchy-pi-fraiche,import_images/givenchy-pi-fraiche/1.avif,1,1,Givenchy Pi Fraiche фото 1
givenchy-pi-neo,import_images/givenchy-pi-neo/1.avif,1,1,Givenchy Pi NEO фото 1
givenchy-very-irresistible,import_images/givenchy-very-irresistible/1.avif,1,1,Givenchy Very Irresistible фото 1
givenchy-very-irresistible-edition-croisiere,import_images/givenchy-very-irresistible-edition-croisiere/1.avif,1,1,Givenchy Very Irresistible Edition Croisiere фото 1
givenchy-very-irresistible-electric-rose,import_images/givenchy-very-irresistible-electric-rose/1.avif,1,1,Givenchy Very Irresistible Electric Rose фото 1
givenchy-very-irresistible-for-man,import_images/givenchy-very-irresistible-for-man/1.avif,1,1,Givenchy Very Irresistible For Man фото 1
givenchy-very-irresistible-for-men,import_images/givenchy-very-irresistible-for-men/1.avif,1,1,Givenchy Very Irresistible For Men фото 1
givenchy-very-irresistible-fresh-attitude,import_images/givenchy-very-irresistible-fresh-attitude/1.avif,1,1,Givenchy Very Irresistible Fresh Attitude фото 1
givenchy-very-irresistible-leau-en-rose,import_images/givenchy-very-irresistible-leau-en-rose/1.avif,1,1,Givenchy Very Irresistible L`Eau en Rose фото 1
givenchy-very-irresistible-lintense,import_images/givenchy-very-irresistible-lintense/1.avif,1,1,Givenchy Very Irresistible L`Intense фото 1
givenchy-very-irresistible-mes-envies,import_images/givenchy-very-irresistible-mes-envies/1.avif,1,1,Givenchy Very Irresistible Mes Envies фото 1
givenchy-very-irresistible-poesie-dun-parfum-dhiver,import_images/givenchy-very-irresistible-poesie-dun-parfum-dhiver/1.avif,1,1,Givenchy Very Irresistible Poesie d`un Parfum d`Hiver фото 1
givenchy-very-irresistible-sensual,import_images/givenchy-very-irresistible-sensual/1.avif,1,1,Givenchy Very Irresistible Sensual фото 1
gucci-bamboo,import_images/gucci-bamboo/1.avif,1,1,Gucci Bamboo EDP фото 1
gucci-bamboo-eau-de-toilette,import_images/gucci-bamboo-eau-de-toilette/1.avif,1,1,Gucci Bamboo EDT фото 1
gucci-bloom-acqua-di-fiori,import_images/gucci-bloom-acqua-di-fiori/1.avif,1,1,Gucci Bloom Acqua Di Fiori фото 1
gucci-bloom-ambrosia-di-fiori,import_images/gucci-bloom-ambrosia-di-fiori/1.avif,1,1,Gucci Bloom Ambrosia di Fiori фото 1
gucci-bloom-nettare-di-fiori,import_images/gucci-bloom-nettare-di-fiori/1.avif,1,1,Gucci Bloom Nettare Di Fiori фото 1
gucci-bloom-profumo-di-fiori,import_images/gucci-bloom-profumo-di-fiori/1.avif,1,1,Gucci Bloom Profumo Di Fiori фото 1
gucci-by-gucci,import_images/gucci-by-gucci/1.avif,1,1,Gucci by Gucci EDP фото 1
gucci-by-gucci-eau-de-toilette,import_images/gucci-by-gucci-eau-de-toilette/1.avif,1,1,Gucci by Gucci EDT фото 1
gucci-by-gucci-generous-violet,import_images/gucci-by-gucci-generous-violet/1.avif,1,1,Gucci Flora by Gucci Generous Violet фото 1
gucci-by-gucci-glorious-mandarin,import_images/gucci-by-gucci-glorious-mandarin/1.avif,1,1,Gucci by Gucci Glorious Mandarin фото 1
gucci-by-gucci-gracious-tuberose,import_images/gucci-by-gucci-gracious-tuberose/1.avif,1,1,Gucci by Gucci Gracious Tuberose фото 1
gucci-by-gucci-made-to-measure,import_images/gucci-by-gucci-made-to-measure/1.avif,1,1,Gucci By Gucci  Made To Measure фото 1
gucci-by-gucci-pour-homme-sport,import_images/gucci-by-gucci-pour-homme-sport/1.avif,1,1,Gucci By Gucci Pour Homme Sport фото 1
gucci-by-gucci-premiere,import_images/gucci-by-gucci-premiere/1.avif,1,1,Gucci by Gucci Premiere фото 1
gucci-envy,import_images/gucci-envy/1.avif,1,1,Gucci Envy фото 1
gucci-envy-for-men,import_images/gucci-envy-for-men/1.avif,1,1,Gucci Envy for Men фото 1
gucci-envy-me,import_images/gucci-envy-me/1.avif,1,1,Gucci Envy Me фото 1
gucci-envy-me-2,import_images/gucci-envy-me-2/1.avif,1,1,Gucci Envy Me 2 фото 1
gucci-flora-gorgeous-gardenia,import_images/gucci-flora-gorgeous-gardenia/1.avif,1,1,Gucci Flora Gorgeous Gardenia фото 1
gucci-flora-gorgeous-jasmine,import_images/gucci-flora-gorgeous-jasmine/1.avif,1,1,Gucci Flora Gorgeous Jasmine фото 1
gucci-guilty-absolute-pour-femme,import_images/gucci-guilty-absolute-pour-femme/1.avif,1,1,Gucci Guilty Absolute Pour Femme фото 1
gucci-guilty-absolute-pour-homme,import_images/gucci-guilty-absolute-pour-homme/1.avif,1,1,Gucci Guilty Absolute Pour Homme фото 1
gucci-guilty-black-pour-homme,import_images/gucci-guilty-black-pour-homme/1.avif,1,1,Gucci Guilty Black Pour Homme фото 1
gucci-pour-homme,import_images/gucci-pour-homme/1.avif,1,1,Gucci pour homme фото 1
gucci-pour-homme-ii,import_images/gucci-pour-homme-ii/1.avif,1,1,Gucci Pour Homme II фото 1
gucci-pour-homme-new,import_images/gucci-pour-homme-new/1.avif,1,1,Gucci Pour Homme New фото 1
gucci-rush,import_images/gucci-rush/1.avif,1,1,Gucci Rush фото 1
gucci-rush-2,import_images/gucci-rush-2/1.avif,1,1,Gucci Rush 2 фото 1
hermes-bel-ami-vetiver,import_images/hermes-bel-ami-vetiver/1.avif,1,1,Hermes Bel Ami Vetiver фото 1
hermes-eau-de-citron-noir,import_images/hermes-eau-de-citron-noir/1.avif,1,1,Hermes Eau de Citron Noir фото 1
hermes-eau-de-mandarine-ambree,import_images/hermes-eau-de-mandarine-ambree/1.avif,1,1,Hermes Eau de Mandarine Ambree фото 1
hermes-eau-de-neroli-dore,import_images/hermes-eau-de-neroli-dore/1.avif,1,1,Hermes Eau de Neroli Dore фото 1
