product_slug,image_path,is_main,sort_order,alt
muzhskie-dukhi-yves-saint-laurent-y-eau-de-parfum-intense,import_images/muzhskie-dukhi-yves-saint-laurent-y-eau-de-parfum-intense/1.avif,1,1,Yves Saint Laurent Y Eau de Parfum Intense фото 1
muzhskie-dukhi-yves-saint-laurent-y-le-parfum,import_images/muzhskie-dukhi-yves-saint-laurent-y-le-parfum/1.avif,1,1,Yves Saint Laurent Y Le Parfum фото 1
narciso-rodriguez-fleur-musc-for-her-eau-de-toilette-florale,import_images/narciso-rodriguez-fleur-musc-for-her-eau-de-toilette-florale/1.avif,1,1,Narciso Rodriguez Fleur Musc For Her Eau de Toilette Florale фото 1
narciso-rodriguez-musc-noir-for-her-eau-de-parfum,import_images/narciso-rodriguez-musc-noir-for-her-eau-de-parfum/1.avif,1,1,Narciso Rodriguez Musc Noir For Her Eau de Parfum фото 1
narciso-rodriguez-narciso-eau-de-parfum-ambree,import_images/narciso-rodriguez-narciso-eau-de-parfum-ambree/1.avif,1,1,Narciso Rodriguez Narciso Eau De Parfum Ambree фото 1
narciso-rodriguez-pure-musc,import_images/narciso-rodriguez-pure-musc/1.avif,1,1,Narciso Rodriguez Pure Musc фото 1
nasomatto-absinth,import_images/nasomatto-absinth/1.avif,1,1,Nasomatto Absinth фото 1
nasomatto-baraonda,import_images/nasomatto-baraonda/1.avif,1,1,Nasomatto Baraonda фото 1
nasomatto-black-afgano,import_images/nasomatto-black-afgano/1.avif,1,1,Nasomatto Black Afgano фото 1
nasomatto-blamage,import_images/nasomatto-blamage/1.avif,1,1,Nasomatto Blamage фото 1
nasomatto-china-white,import_images/nasomatto-china-white/1.avif,1,1,Nasomatto China White фото 1
nasomatto-duro,import_images/nasomatto-duro/1.avif,1,1,Nasomatto Duro фото 1
nasomatto-fantomas,import_images/nasomatto-fantomas/1.avif,1,1,Nasomatto Fantomas фото 1
nasomatto-hindu-grass,import_images/nasomatto-hindu-grass/1.avif,1,1,Nasomatto Hindu Grass фото 1
nasomatto-narcotic-venus,import_images/nasomatto-narcotic-venus/1.avif,1,1,Nasomatto Narcotic Venus фото 1
nasomatto-nuda,import_images/nasomatto-nuda/1.avif,1,1,Nasomatto Nuda фото 1
nasomatto-pardon,import_images/nasomatto-pardon/1.avif,1,1,Nasomatto Pardon фото 1
nasomatto-silver-musk,import_images/nasomatto-silver-musk/1.avif,1,1,Nasomatto Silver Musk фото 1
nishane-ambra-calabria,import_images/nishane-ambra-calabria/1.avif,1,1,Nishane Ambra Calabria фото 1
nishane-ani,import_images/nishane-ani/1.avif,1,1,Nishane Ani фото 1
nishane-hacivat,import_images/nishane-hacivat/1.avif,1,1,Nishane Hacivat фото 1
nishane-hacivat-x,import_images/nishane-hacivat-x/1.avif,1,1,Nishane Hacivat X фото 1
nishane-hundred-silent-ways,import_images/nishane-hundred-silent-ways/1.avif,1,1,Nishane Hundred Silent Ways фото 1
nishane-hundred-silent-ways-x,import_images/nishane-hundred-silent-ways-x/1.avif,1,1,Nishane Hundred Silent Ways X фото 1
nishane-shem,import_images/nishane-shem/1.avif,1,1,Nishane Shem фото 1
nishane-wulong-cha-x,import_images/nishane-wulong-cha-x/1.avif,1,1,Nishane Wulong Cha X фото 1
nishane-zenne,import_images/nishane-zenne/1.avif,1,1,Nishane Zenne фото 1
orto-parisi-bergamask,import_images/orto-parisi-bergamask/1.avif,1,1,Orto Parisi Bergamask фото 1
orto-parisi-boccanera,import_images/orto-parisi-boccanera/1.avif,1,1,Orto Parisi Boccanera фото 1
orto-parisi-brutus,import_images/orto-parisi-brutus/1.avif,1,1,Orto Parisi Brutus фото 1
orto-parisi-cuoium,import_images/orto-parisi-cuoium/1.avif,1,1,Orto Parisi Cuoium фото 1
orto-parisi-megamare,import_images/orto-parisi-megamare/1.avif,1,1,Orto Parisi Megamare фото 1
orto-parisi-seminalis,import_images/orto-parisi-seminalis/1.avif,1,1,Orto Parisi Seminalis фото 1
orto-parisi-stercus,import_images/orto-parisi-stercus/1.avif,1,1,Orto Parisi Stercus фото 1
orto-parisi-terroni,import_images/orto-parisi-terroni/1.avif,1,1,Orto Parisi Terroni фото 1
orto-parisi-viride,import_images/orto-parisi-viride/1.avif,1,1,Orto Parisi Viride фото 1
paco-rabanne-1-million,import_images/paco-rabanne-1-million/1.avif,1,1,Paco Rabanne 1 Million фото 1
paco-rabanne-1-million-cologne,import_images/paco-rabanne-1-million-cologne/1.avif,1,1,Paco Rabanne 1 Million Cologne фото 1
paco-rabanne-1-million-elixir,import_images/paco-rabanne-1-million-elixir/1.avif,1,1,Paco Rabanne 1 Million Elixir фото 1
paco-rabanne-1-million-intense,import_images/paco-rabanne-1-million-intense/1.avif,1,1,Paco Rabanne 1 Million Intense фото 1
paco-rabanne-1-million-lucky,import_images/paco-rabanne-1-million-lucky/1.avif,1,1,Paco Rabanne 1 Million Lucky фото 1
paco-rabanne-1-million-parfum,import_images/paco-rabanne-1-million-parfum/1.avif,1,1,Paco Rabanne 1 Million Parfum фото 1
paco-rabanne-1-million-prive,import_images/paco-rabanne-1-million-prive/1.avif,1,1,Paco Rabanne 1 Million Prive фото 1
paco-rabanne-1-million-royal,import_images/paco-rabanne-1-million-royal/1.avif,1,1,Paco Rabanne 1 Million Royal фото 1
paco-rabanne-black-xs,import_images/paco-rabanne-black-xs/1.avif,1,1,Paco Rabanne  Black XS фото 1
paco-rabanne-black-xs-femme,import_images/paco-rabanne-black-xs-femme/1.avif,1,1,Paco Rabanne Black XS фото 1
paco-rabanne-black-xs-for-her-eau-de-parfum,import_images/paco-rabanne-black-xs-for-her-eau-de-parfum/1.avif,1,1,Paco Rabanne Black XS for Her Eau de Parfum фото 1
paco-rabanne-black-xs-los-angeles,import_images/paco-rabanne-black-xs-los-angeles/1.avif,1,1,Paco Rabanne Black XS Los Angeles фото 1
paco-rabanne-black-xs-new,import_images/paco-rabanne-black-xs-new/1.avif,1,1,Paco Rabanne Black XS фото 1
paco-rabanne-black-xs-potion-for-her,import_images/paco-rabanne-black-xs-potion-for-her/1.avif,1,1,Paco Rabanne Black XS Potion for Her фото 1
paco-rabanne-black-xs-potion-for-him,import_images/paco-rabanne-black-xs-potion-for-him/1.avif,1,1,Paco Rabanne Black XS Potion for Him фото 1
paco-rabanne-fame,import_images/paco-rabanne-fame/1.avif,1,1,Paco Rabanne Fame фото 1
paco-rabanne-invictus,import_images/paco-rabanne-invictus/1.avif,1,1,Paco Rabanne Invictus фото 1
paco-rabanne-invictus-aqua,import_images/paco-rabanne-invictus-aqua/1.avif,1,1,Paco Rabanne Invictus Aqua фото 1
paco-rabanne-invictus-intense,import_images/paco-rabanne-invictus-intense/1.avif,1,1,Paco Rabanne Invictus Intense фото 1
paco-rabanne-invictus-legend,import_images/paco-rabanne-invictus-legend/1.avif,1,1,Paco Rabanne Invictus Legend фото 1
paco-rabanne-invictus-onyx,import_images/paco-rabanne-invictus-onyx/1.avif,1,1,Paco Rabanne Invictus Onyx фото 1
paco-rabanne-invictus-platinum,import_images/paco-rabanne-invictus-platinum/1.avif,1,1,Paco Rabanne Invictus Platinum фото 1
paco-rabanne-invictus-victory,import_images/paco-rabanne-invictus-victory/1.avif,1,1,Paco Rabanne Invictus Victory фото 1
paco-rabanne-invictus-victory-elixir,import_images/paco-rabanne-invictus-victory-elixir/1.avif,1,1,Paco Rabanne Invictus Victory Elixir фото 1
paco-rabanne-lady-million,import_images/paco-rabanne-lady-million/1.avif,1,1,Paco Rabanne Lady Million фото 1
paco-rabanne-lady-million-absolutely-gold,import_images/paco-rabanne-lady-million-absolutely-gold/1.avif,1,1,Paco Rabanne Lady Million Absolutely Gold фото 1
paco-rabanne-lady-million-collector-edition,import_images/paco-rabanne-lady-million-collector-edition/1.avif,1,1,Paco Rabanne Lady Million Collector Edition фото 1
paco-rabanne-lady-million-eau-my-gold,import_images/paco-rabanne-lady-million-eau-my-gold/1.avif,1,1,Paco Rabanne Lady Million Eau My Gold фото 1
paco-rabanne-lady-million-empire,import_images/paco-rabanne-lady-million-empire/1.avif,1,1,Paco Rabanne Lady Million Empire фото 1
paco-rabanne-lady-million-fabulous,import_images/paco-rabanne-lady-million-fabulous/1.avif,1,1,Paco Rabanne Lady Million Fabulous фото 1
paco-rabanne-lady-million-lucky,import_images/paco-rabanne-lady-million-lucky/1.avif,1,1,Paco Rabanne Lady Million Lucky фото 1
paco-rabanne-lady-million-prive,import_images/paco-rabanne-lady-million-prive/1.avif,1,1,Paco Rabanne Lady Million Prive фото 1
paco-rabanne-lady-million-royal,import_images/paco-rabanne-lady-million-royal/1.avif,1,1,Paco Rabanne Lady Million Royal фото 1
paco-rabanne-olympea,import_images/paco-rabanne-olympea/1.avif,1,1,Paco Rabanne Olympea фото 1
paco-rabanne-olympea-aqua,import_images/paco-rabanne-olympea-aqua/1.avif,1,1,Paco Rabanne Olympea Aqua фото 1
paco-rabanne-olympea-aqua-legere,import_images/paco-rabanne-olympea-aqua-legere/1.avif,1,1,Paco Rabanne Olympea Aqua Legere фото 1
paco-rabanne-olympea-blossom,import_images/paco-rabanne-olympea-blossom/1.avif,1,1,Paco Rabanne Olympea Blossom фото 1
paco-rabanne-olympea-flora,import_images/paco-rabanne-olympea-flora/1.avif,1,1,Paco Rabanne Olympea Flora фото 1
paco-rabanne-olympea-intense,import_images/paco-rabanne-olympea-intense/1.avif,1,1,Paco Rabanne Olympea Intense фото 1
paco-rabanne-olympea-legend,import_images/paco-rabanne-olympea-legend/1.avif,1,1,Paco Rabanne Olympea Legend фото 1
paco-rabanne-olympea-onyx,import_images/paco-rabanne-olympea-onyx/1.avif,1,1,Paco Rabanne Olympea Onyx фото 1
paco-rabanne-olympea-solar,import_images/paco-rabanne-olympea-solar/1.avif,1,1,Paco Rabanne Olympea Solar фото 1
paco-rabanne-phantom,import_images/paco-rabanne-phantom/1.avif,1,1,Paco Rabanne Phantom фото 1
paco-rabanne-phantom-legion,import_images/paco-rabanne-phantom-legion/1.avif,1,1,Paco Rabanne Phantom Legion фото 1
paco-rabanne-phantom-parfum,import_images/paco-rabanne-phantom-parfum/1.avif,1,1,Paco Rabanne Phantom Parfum фото 1
paco-rabanne-ultraviolet-fluoressence,import_images/paco-rabanne-ultraviolet-fluoressence/1.avif,1,1,Paco Rabanne Ultraviolet Fluoressence фото 1
paco-rabanne-ultraviolet-for-men,import_images/paco-rabanne-ultraviolet-for-men/1.avif,1,1,Paco Rabanne Ultraviolet for Men фото 1
paco-rabanne-ultraviolet-liquid-metal-for-woman,import_images/paco-rabanne-ultraviolet-liquid-metal-for-woman/1.avif,1,1,Paco Rabanne Ultraviolet Liquid Metal for Woman фото 1
paco-rabanne-ultraviolet-new,import_images/paco-rabanne-ultraviolet-new/1.avif,1,1,Paco Rabanne Ultraviolet (new) фото 1
roja-dove-a-midsummer-dream,import_images/roja-dove-a-midsummer-dream/1.avif,1,1,Roja Dove A Midsummer Dream фото 1
roja-dove-amber-aoud,import_images/roja-dove-amber-aoud/1.avif,1,1,Roja Dove Amber Aoud фото 1
roja-dove-amber-aoud-crystal,import_images/roja-dove-amber-aoud-crystal/1.avif,1,1,Roja Dove Amber Aoud Crystal фото 1
roja-dove-burlington-1819,import_images/roja-dove-burlington-1819/1.avif,1,1,Roja Dove Burlington 1819 фото 1
roja-dove-danger-pour-femme,import_images/roja-dove-danger-pour-femme/1.avif,1,1,Roja Dove Danger Pour Femme фото 1
roja-dove-danger-pour-femme-essence-de-parfum,import_images/roja-dove-danger-pour-femme-essence-de-parfum/1.avif,1,1,Roja Dove Danger Pour Femme Essence De Parfum фото 1
roja-dove-danger-pour-homme,import_images/roja-dove-danger-pour-homme/1.avif,1,1,Roja Dove Danger Pour Homme фото 1
roja-dove-elysium-pour-homme,import_images/roja-dove-elysium-pour-homme/1.avif,1,1,Roja Dove Elysium Pour Homme фото 1
roja-dove-enigma-pour-homme,import_images/roja-dove-enigma-pour-homme/1.avif,1,1,Roja Dove Enigma Pour Homme фото 1
roja-dove-fortnum-mason-taif-aoud,import_images/roja-dove-fortnum-mason-taif-aoud/1.avif,1,1,Roja Dove Fortnum & Mason Taif Aoud фото 1
roja-dove-oceania,import_images/roja-dove-oceania/1.avif,1,1,Roja Dove Oceania фото 1
roja-dove-parfums-elysium-parfum-cologne,import_images/roja-dove-parfums-elysium-parfum-cologne/1.avif,1,1,Roja Dove Elysium Pour Homme Parfum Cologne фото 1
roja-dove-reckless-pour-homme,import_images/roja-dove-reckless-pour-homme/1.avif,1,1,Roja Dove Reckless Pour Homme фото 1
roja-dove-scandal-pour-homme,import_images/roja-dove-scandal-pour-homme/1.avif,1,1,Roja Dove Scandal Pour Homme фото 1
roja-dove-sweetie-aoud,import_images/roja-dove-sweetie-aoud/1.avif,1,1,Roja Dove Sweetie Aoud фото 1
roja-dove-vetiver-pour-homme,import_images/roja-dove-vetiver-pour-homme/1.avif,1,1,Roja Dove Vetiver Pour Homme фото 1
roja-parfums-scandal-pour-femme-essence-de-parfum,import_images/roja-parfums-scandal-pour-femme-essence-de-parfum/1.avif,1,1,Roja Parfums Scandal Pour Femme Essence De Parfum фото 1
tiziana-terenzi-al-contrario,import_images/tiziana-terenzi-al-contrario/1.avif,1,1,Tiziana Terenzi Al Contrario фото 1
tiziana-terenzi-andromeda,import_images/tiziana-terenzi-andromeda/1.avif,1,1,Tiziana Terenzi Andromeda фото 1
tiziana-terenzi-arethusa,import_images/tiziana-terenzi-arethusa/1.avif,1,1,Tiziana Terenzi Arethusa фото 1
tiziana-terenzi-arrakis,import_images/tiziana-terenzi-arrakis/1.avif,1,1,Tiziana Terenzi Arrakis фото 1
tiziana-terenzi-atlantide,import_images/tiziana-terenzi-atlantide/1.avif,1,1,Tiziana Terenzi Atlantide фото 1
tiziana-terenzi-borea,import_images/tiziana-terenzi-borea/1.avif,1,1,Tiziana Terenzi Borea фото 1
tiziana-terenzi-caput-mundi,import_images/tiziana-terenzi-caput-mundi/1.avif,1,1,Tiziana Terenzi Caput Mundi фото 1
tiziana-terenzi-cassiopea,import_images/tiziana-terenzi-cassiopea/1.avif,1,1,Tiziana Terenzi Cassiopea фото 1
tiziana-terenzi-chiron,import_images/tiziana-terenzi-chiron/1.avif,1,1,Tiziana Terenzi Chiron фото 1
tiziana-terenzi-cubia,import_images/tiziana-terenzi-cubia/1.avif,1,1,Tiziana Terenzi Cubia фото 1
tiziana-terenzi-delox,import_images/tiziana-terenzi-delox/1.avif,1,1,Tiziana Terenzi Delox фото 1
tiziana-terenzi-dionisio,import_images/tiziana-terenzi-dionisio/1.avif,1,1,Tiziana Terenzi Dionisio фото 1
tiziana-terenzi-draco,import_images/tiziana-terenzi-draco/1.avif,1,1,Tiziana Terenzi Draco фото 1
tiziana-terenzi-ecstasy,import_images/tiziana-terenzi-ecstasy/1.avif,1,1,Tiziana Terenzi Ecstasy фото 1
tiziana-terenzi-foconero,import_images/tiziana-terenzi-foconero/1.avif,1,1,Tiziana Terenzi Foconero фото 1
tiziana-terenzi-gold-rose-oudh,import_images/tiziana-terenzi-gold-rose-oudh/1.avif,1,1,Tiziana Terenzi Gold Rose Oudh фото 1
tiziana-terenzi-halley,import_images/tiziana-terenzi-halley/1.avif,1,1,Tiziana Terenzi Halley фото 1
tiziana-terenzi-kirke,import_images/tiziana-terenzi-kirke/1.avif,1,1,Tiziana Terenzi Kirke фото 1
tiziana-terenzi-kirke-overdose,import_images/tiziana-terenzi-kirke-overdose/1.avif,1,1,Tiziana Terenzi Kirke Overdose фото 1
tiziana-terenzi-leo,import_images/tiziana-terenzi-leo/1.avif,1,1,Tiziana Terenzi Leo фото 1
tiziana-terenzi-lillipur,import_images/tiziana-terenzi-lillipur/1.avif,1,1,Tiziana Terenzi Lillipur фото 1
tiziana-terenzi-maremma,import_images/tiziana-terenzi-maremma/1.avif,1,1,Tiziana Terenzi Maremma фото 1
tiziana-terenzi-mirach,import_images/tiziana-terenzi-mirach/1.avif,1,1,Tiziana Terenzi Mirach фото 1
tiziana-terenzi-orza,import_images/tiziana-terenzi-orza/1.avif,1,1,Tiziana Terenzi Orza фото 1
tiziana-terenzi-poggia,import_images/tiziana-terenzi-poggia/1.avif,1,1,Tiziana Terenzi Poggia фото 1
tiziana-terenzi-porpora,import_images/tiziana-terenzi-porpora/1.avif,1,1,Tiziana Terenzi Porpora фото 1
tiziana-terenzi-sirrah,import_images/tiziana-terenzi-sirrah/1.avif,1,1,Tiziana Terenzi Sirrah фото 1
tiziana-terenzi-spirito-fiorentino,import_images/tiziana-terenzi-spirito-fiorentino/1.avif,1,1,Tiziana Terenzi Spirito Fiorentino фото 1
tiziana-terenzi-tabit,import_images/tiziana-terenzi-tabit/1.avif,1,1,Tiziana Terenzi Tabit фото 1
tiziana-terenzi-ursa,import_images/tiziana-terenzi-ursa/1.avif,1,1,Tiziana Terenzi Ursa фото 1
tiziana-terenzi-vele,import_images/tiziana-terenzi-vele/1.avif,1,1,Tiziana Terenzi Vele фото 1
tiziana-terenzi-white-fire,import_images/tiziana-terenzi-white-fire/1.avif,1,1,Tiziana Terenzi White Fire фото 1
tiziana-terenzi-xix-march,import_images/tiziana-terenzi-xix-march/1.avif,1,1,Tiziana Terenzi XIX March фото 1
tom-ford-beau-de-jour,import_images/tom-ford-beau-de-jour/1.avif,1,1,Tom Ford Beau De Jour фото 1
tom-ford-beau-de-jour-private-collection,import_images/tom-ford-beau-de-jour-private-collection/1.avif,1,1,Tom Ford Beau de Jour Private Collection фото 1
tom-ford-black-orchid,import_images/tom-ford-black-orchid/1.avif,1,1,Tom Ford Black Orchid фото 1
tom-ford-black-orchid-eau-de-toilette,import_images/tom-ford-black-orchid-eau-de-toilette/1.avif,1,1,Tom Ford Black Orchid Eau de Toilette фото 1
tom-ford-black-orchid-parfum,import_images/tom-ford-black-orchid-parfum/1.avif,1,1,Tom Ford Black Orchid Parfum фото 1
tom-ford-costa-azzurra,import_images/tom-ford-costa-azzurra/1.avif,1,1,Tom Ford Costa Azzurra фото 1
tom-ford-costa-azzurra-acqua,import_images/tom-ford-costa-azzurra-acqua/1.avif,1,1,Tom Ford Costa Azzurra Acqua фото 1
tom-ford-costa-azzurra-parfum,import_images/tom-ford-costa-azzurra-parfum/1.avif,1,1,Tom Ford Costa Azzurra Parfum фото 1
tom-ford-eau-de-jasmin-rouge,import_images/tom-ford-eau-de-jasmin-rouge/1.avif,1,1,Tom Ford Eau de Jasmin Rouge фото 1
tom-ford-eau-de-soleil-blanc,import_images/tom-ford-eau-de-soleil-blanc/1.avif,1,1,Tom Ford Eau De Soleil Blanc фото 1
tom-ford-electric-cherry,import_images/tom-ford-electric-cherry/1.avif,1,1,Tom Ford Electric Cherry фото 1
tom-ford-fucking-fabulous,import_images/tom-ford-fucking-fabulous/1.avif,1,1,Tom Ford Fucking Fabulous фото 1
tom-ford-grey-vetiver,import_images/tom-ford-grey-vetiver/1.avif,1,1,Tom Ford Grey Vetiver фото 1
tom-ford-jasmin-rouge,import_images/tom-ford-jasmin-rouge/1.avif,1,1,Tom Ford Jasmin Rouge фото 1
tom-ford-lost-cherry,import_images/tom-ford-lost-cherry/1.avif,1,1,Tom Ford Lost Cherry фото 1
tom-ford-mandarino-di-amalfi,import_images/tom-ford-mandarino-di-amalfi/1.avif,1,1,Tom Ford Mandarino di Amalfi фото 1
tom-ford-mandarino-di-amalfi-acqua,import_images/tom-ford-mandarino-di-amalfi-acqua/1.avif,1,1,Tom Ford Mandarino Di Amalfi Acqua фото 1
tom-ford-neroli-portofino,import_images/tom-ford-neroli-portofino/1.avif,1,1,Tom Ford Neroli Portofino фото 1
tom-ford-neroli-portofino-acqua,import_images/tom-ford-neroli-portofino-acqua/1.avif,1,1,Tom Ford Neroli Portofino Acqua фото 1
tom-ford-neroli-portofino-forte,import_images/tom-ford-neroli-portofino-forte/1.avif,1,1,Tom Ford Neroli Portofino Forte фото 1
tom-ford-noir-anthracite,import_images/tom-ford-noir-anthracite/1.avif,1,1,Tom Ford Noir Anthracite фото 1
tom-ford-noir-de-noir,import_images/tom-ford-noir-de-noir/1.avif,1,1,Tom Ford Noir de Noir фото 1
tom-ford-noir-eau-de-toilette,import_images/tom-ford-noir-eau-de-toilette/1.avif,1,1,Tom Ford Noir Eau de Toilette фото 1
tom-ford-noir-extreme,import_images/tom-ford-noir-extreme/1.avif,1,1,Tom Ford Noir Extreme фото 1
tom-ford-noir-for-men,import_images/tom-ford-noir-for-men/1.avif,1,1,Tom Ford Noir for Men фото 1
tom-ford-noir-pour-femme,import_images/tom-ford-noir-pour-femme/1.avif,1,1,Tom Ford Noir Pour Femme фото 1
tom-ford-ombre-leather,import_images/tom-ford-ombre-leather/1.avif,1,1,Tom Ford Ombre Leather фото 1
tom-ford-ombre-leather-16,import_images/tom-ford-ombre-leather-16/1.avif,1,1,Tom Ford Ombre Leather 16 фото 1
tom-ford-ombre-leather-parfum,import_images/tom-ford-ombre-leather-parfum/1.avif,1,1,Tom Ford Ombre Leather Parfum фото 1
tom-ford-oud-wood,import_images/tom-ford-oud-wood/1.avif,1,1,Tom Ford Oud Wood фото 1
tom-ford-oud-wood-intense,import_images/tom-ford-oud-wood-intense/1.avif,1,1,Tom Ford Oud Wood Intense фото 1
tom-ford-rose-damalfi,import_images/tom-ford-rose-damalfi/1.avif,1,1,Tom Ford Rose D'Amalfi фото 1
tom-ford-rose-de-chine,import_images/tom-ford-rose-de-chine/1.avif,1,1,Tom Ford Rose de Chine фото 1
tom-ford-rose-prick,import_images/tom-ford-rose-prick/1.avif,1,1,Tom Ford Rose Prick фото 1
tom-ford-santal-blush,import_images/tom-ford-santal-blush/1.avif,1,1,Tom Ford Santal Blush фото 1
tom-ford-soleil-blanc,import_images/tom-ford-soleil-blanc/1.avif,1,1,Tom Ford Soleil Blanc фото 1
tom-ford-soleil-de-feu,import_images/tom-ford-soleil-de-feu/1.avif,1,1,Tom Ford Soleil de Feu фото 1
tom-ford-soleil-neige,import_images/tom-ford-soleil-neige/1.avif,1,1,Tom Ford Soleil Neige фото 1
tom-ford-tobacco-vanille,import_images/tom-ford-tobacco-vanille/1.avif,1,1,Tom Ford Tobacco Vanille фото 1
tom-ford-tuscan-leather,import_images/tom-ford-tuscan-leather/1.avif,1,1,Tom Ford Tuscan Leather фото 1
tom-ford-tuscan-leather-intense,import_images/tom-ford-tuscan-leather-intense/1.avif,1,1,Tom Ford Tuscan Leather Intense фото 1
tom-ford-vanille-fatale,import_images/tom-ford-vanille-fatale/1.avif,1,1,Tom Ford Vanille Fatale фото 1
trussardi-aperitivo-milanese-porta-nuova,import_images/trussardi-aperitivo-milanese-porta-nuova/1.avif,1,1,Trussardi Aperitivo Milanese Porta Nuova фото 1
trussardi-blue-land,import_images/trussardi-blue-land/1.avif,1,1,Trussardi Blue Land фото 1
trussardi-donna-eau-de-toilette,import_images/trussardi-donna-eau-de-toilette/1.avif,1,1,Trussardi Donna Eau De Toilette фото 1
trussardi-jeans,import_images/trussardi-jeans/1.avif,1,1,Trussardi Jeans фото 1
trussardi-jeans-men,import_images/trussardi-jeans-men/1.avif,1,1,Trussardi Jeans Men фото 1
trussardi-my-land,import_images/trussardi-my-land/1.avif,1,1,Trussardi My Land фото 1
trussardi-passeggiata-in-galleria-vittorio-emanuele-ii,import_images/trussardi-passeggiata-in-galleria-vittorio-emanuele-ii/1.avif,1,1,Trussardi Passeggiata In Galleria Vittorio Emanuele II фото 1
trussardi-python,import_images/trussardi-python/1.jpg,1,1,Trussardi Python фото 1
trussardi-python-woman,import_images/trussardi-python-woman/1.avif,1,1,Trussardi Python Woman фото 1
trussardi-riflesso,import_images/trussardi-riflesso/1.avif,1,1,Trussardi Riflesso фото 1
trussardi-riflesso-blue-vibe,import_images/trussardi-riflesso-blue-vibe/1.avif,1,1,Trussardi Riflesso Blue Vibe фото 1
trussardi-riflesso-streets-of-milano,import_images/trussardi-riflesso-streets-of-milano/1.avif,1,1,Trussardi Riflesso Streets of Milano фото 1
versace-blue-jeans,import_images/versace-blue-jeans/1.avif,1,1,Versace Blue Jeans фото 1
versace-bright-crystal,import_images/versace-bright-crystal/1.avif,1,1,Versace Bright Crystal фото 1
versace-bright-crystal-absolu,import_images/versace-bright-crystal-absolu/1.avif,1,1,Versace Bright Crystal Absolu фото 1
versace-crystal-noir,import_images/versace-crystal-noir/1.avif,1,1,Versace Crystal Noir фото 1
versace-crystal-noir-eau-de-toilette,import_images/versace-crystal-noir-eau-de-toilette/1.avif,1,1,Versace Crystal Noir Eau de Toilette фото 1
versace-dylan-blue-pour-femme,import_images/versace-dylan-blue-pour-femme/1.avif,1,1,Versace Dylan Blue Pour Femme фото 1
versace-dylan-turquoise-pour-femme,import_images/versace-dylan-turquoise-pour-femme/1.avif,1,1,Versace Dylan Turquoise Pour Femme фото 1
versace-eros-eau-de-parfum,import_images/versace-eros-eau-de-parfum/1.avif,1,1,Versace Eros man EDP фото 1
versace-eros-energy,import_images/versace-eros-energy/1.avif,1,1,Versace Eros Energy фото 1
versace-eros-flame,import_images/versace-eros-flame/1.avif,1,1,Versace Eros Flame фото 1
versace-eros-man,import_images/versace-eros-man/1.avif,1,1,Versace Eros man EDT фото 1
versace-eros-parfum,import_images/versace-eros-parfum/1.avif,1,1,Versace Eros man Parfum фото 1
versace-eros-pour-femme-edp,import_images/versace-eros-pour-femme-edp/1.avif,1,1,Versace Eros Femme EDP фото 1
versace-eros-pour-femme-edt,import_images/versace-eros-pour-femme-edt/1.avif,1,1,Versace Eros Femme EDT фото 1
versace-lhomme,import_images/versace-lhomme/1.avif,1,1,Versace L'Homme фото 1
versace-man-eau-fraiche,import_images/versace-man-eau-fraiche/1.avif,1,1,Versace Man Eau Fraiche фото 1
versace-man-eau-fraiche-extreme,import_images/versace-man-eau-fraiche-extreme/1.avif,1,1,Versace Man Eau Fraiche Extreme фото 1
versace-pour-femme-dylan-purple,import_images/versace-pour-femme-dylan-purple/1.avif,1,1,Versace Dylan Purple Pour Femme фото 1
versace-pour-homme,import_images/versace-pour-homme/1.avif,1,1,Versace Pour Homme фото 1
versace-pour-homme-dylan-blue,import_images/versace-pour-homme-dylan-blue/1.avif,1,1,Versace Dylan Blue Pour Homme фото 1
versace-pour-homme-oud-noir,import_images/versace-pour-homme-oud-noir/1.avif,1,1,Versace Pour Homme Oud Noir фото 1
versace-red-jeans,import_images/versace-red-jeans/1.avif,1,1,Versace Red Jeans фото 1
versace-versense,import_images/versace-versense/1.avif,1,1,Versace Versense фото 1
versace-yellow-diamond,import_images/versace-yellow-diamond/1.avif,1,1,Versace Yellow Diamond фото 1
versace-yellow-diamond-intense,import_images/versace-yellow-diamond-intense/1.avif,1,1,Versace Yellow Diamond Intense фото 1
vilhelm-parfumerie-a-lilac-a-day,import_images/vilhelm-parfumerie-a-lilac-a-day/1.avif,1,1,Vilhelm Parfumerie A Lilac a Day фото 1
vilhelm-parfumerie-basilico-fellini,import_images/vilhelm-parfumerie-basilico-fellini/1.avif,1,1,Vilhelm Parfumerie Basilico & Fellini фото 1
vilhelm-parfumerie-black-citrus,import_images/vilhelm-parfumerie-black-citrus/1.avif,1,1,Vilhelm Parfumerie Black Citrus фото 1
vilhelm-parfumerie-body-paint,import_images/vilhelm-parfumerie-body-paint/1.avif,1,1,Vilhelm Parfumerie Body Paint фото 1
vilhelm-parfumerie-chicago-high,import_images/vilhelm-parfumerie-chicago-high/1.avif,1,1,Vilhelm Parfumerie Chicago High фото 1
vilhelm-parfumerie-dear-polly,import_images/vilhelm-parfumerie-dear-polly/1.avif,1,1,Vilhelm Parfumerie Dear Polly фото 1
vilhelm-parfumerie-faces-of-francis,import_images/vilhelm-parfumerie-faces-of-francis/1.avif,1,1,Vilhelm Parfumerie Faces of Francis фото 1
