product_slug,image_path,is_main,sort_order,alt
hermes-eau-de-rhubarbe-ecarlate,import_images/hermes-eau-de-rhubarbe-ecarlate/1.avif,1,1,Hermes Eau de Rhubarbe Ecarlate фото 1
hermes-eau-des-merveilles,import_images/hermes-eau-des-merveilles/1.avif,1,1,Hermes Eau Des Merveilles фото 1
hermes-eau-des-merveilles-bleue,import_images/hermes-eau-des-merveilles-bleue/1.avif,1,1,Hermes Eau Des Merveilles Bleue фото 1
hermes-eau-des-merveilles-pegase,import_images/hermes-eau-des-merveilles-pegase/1.avif,1,1,Hermes Eau Des Merveilles Pegase фото 1
hermes-equipage,import_images/hermes-equipage/1.avif,1,1,Hermes Equipage фото 1
hermes-equipage-geranium,import_images/hermes-equipage-geranium/1.avif,1,1,Hermes Equipage Geranium фото 1
hermes-galop-d-hermes,import_images/hermes-galop-d-hermes/1.avif,1,1,Hermes Galop d` Hermes фото 1
hermes-h24,import_images/hermes-h24/1.avif,1,1,Hermes H24 фото 1
hermes-h24-eau-de-parfum,import_images/hermes-h24-eau-de-parfum/1.avif,1,1,Hermes H24 Eau de Parfum фото 1
hermes-le-jardin-de-monsieur-li,import_images/hermes-le-jardin-de-monsieur-li/1.avif,1,1,Hermes Le Jardin de Monsieur Li фото 1
hermes-lombre-des-merveilles,import_images/hermes-lombre-des-merveilles/1.avif,1,1,Hermes L'Ombre Des Merveilles фото 1
hermes-rocabar,import_images/hermes-rocabar/1.avif,1,1,Hermes Rocabar фото 1
hermes-un-jardin-apres-la-mousson,import_images/hermes-un-jardin-apres-la-mousson/1.avif,1,1,Hermes Un Jardin Apres La Mousson фото 1
hermes-un-jardin-sur-le-nil,import_images/hermes-un-jardin-sur-le-nil/1.avif,1,1,Hermes Un Jardin Sur Le Nil фото 1
hermes-un-jardin-sur-le-toit,import_images/hermes-un-jardin-sur-le-toit/1.avif,1,1,Hermes Un Jardin Sur Le Toit фото 1
hormone-paris-adrenaline,import_images/hormone-paris-adrenaline/1.avif,1,1,Hormone Paris This is not Adrenaline фото 1
hormone-paris-dopamine,import_images/hormone-paris-dopamine/1.avif,1,1,Hormone Paris This is not Dopamine фото 1
hormone-paris-endorphin,import_images/hormone-paris-endorphin/1.avif,1,1,Hormone Paris This is not Endorphin фото 1
hormone-paris-oxytocin,import_images/hormone-paris-oxytocin/1.avif,1,1,Hormone Paris This is not Oxytocin фото 1
hormone-paris-this-is-not-testosterone,import_images/hormone-paris-this-is-not-testosterone/1.avif,1,1,Hormone Paris This is not Testosterone фото 1
jean-paul-gaultier-classique,import_images/jean-paul-gaultier-classique/1.avif,1,1,Jean Paul Gaultier Classique фото 1
jean-paul-gaultier-classique-intense,import_images/jean-paul-gaultier-classique-intense/1.avif,1,1,Jean Paul Gaultier Classique Intense фото 1
jean-paul-gaultier-le-male-eau-de-toilette-airlines,import_images/jean-paul-gaultier-le-male-eau-de-toilette-airlines/1.avif,1,1,Jean Paul Gaultier Le Male Eau de Toilette Airlines фото 1
jean-paul-gaultier-le-male-le-parfum-intense,import_images/jean-paul-gaultier-le-male-le-parfum-intense/1.avif,1,1,Jean Paul Gaultier Le Male Le Parfum фото 1
jean-paul-gaultier-scandal,import_images/jean-paul-gaultier-scandal/1.avif,1,1,Jean Paul Gaultier Scandal фото 1
jean-paul-gaultier-scandal-a-paris,import_images/jean-paul-gaultier-scandal-a-paris/1.avif,1,1,Jean Paul Gaultier Scandal A Paris фото 1
jean-paul-gaultier-scandal-pour-homme,import_images/jean-paul-gaultier-scandal-pour-homme/1.avif,1,1,Jean Paul Gaultier Scandal Pour Homme фото 1
jean-paul-gaultier-so-scandal,import_images/jean-paul-gaultier-so-scandal/1.avif,1,1,Jean Paul Gaultier So Scandal! фото 1
jo-malone-blackberry-bay,import_images/jo-malone-blackberry-bay/1.avif,1,1,Jo Malone Blackberry & Bay фото 1
jo-malone-cypress-grapevine,import_images/jo-malone-cypress-grapevine/1.avif,1,1,Jo Malone Cypress & Grapevine фото 1
jo-malone-dark-amber-ginger-lily,import_images/jo-malone-dark-amber-ginger-lily/1.avif,1,1,Jo Malone Dark Amber & Ginger Lily фото 1
jo-malone-earl-grey-cucumber,import_images/jo-malone-earl-grey-cucumber/1.avif,1,1,Jo Malone Earl Grey & Cucumber фото 1
jo-malone-english-pear-freesia,import_images/jo-malone-english-pear-freesia/1.avif,1,1,Jo Malone English Pear & Freesia фото 1
jo-malone-fig-lotus-flower,import_images/jo-malone-fig-lotus-flower/1.avif,1,1,Jo Malone Fig & Lotus Flower фото 1
jo-malone-french-lime-blossom,import_images/jo-malone-french-lime-blossom/1.avif,1,1,Jo Malone French Lime Blossom фото 1
jo-malone-green-almond-redcurrant,import_images/jo-malone-green-almond-redcurrant/1.avif,1,1,Jo Malone Green Almond & Redcurrant фото 1
jo-malone-honeysuckle-davana,import_images/jo-malone-honeysuckle-davana/1.avif,1,1,Jo Malone Honeysuckle & Davana фото 1
jo-malone-jasmine-sambac-marigold,import_images/jo-malone-jasmine-sambac-marigold/1.avif,1,1,Jo Malone Jasmine Sambac & Marigold фото 1
jo-malone-lime-basil-mandarin,import_images/jo-malone-lime-basil-mandarin/1.avif,1,1,Jo Malone Lime Basil & Mandarin фото 1
jo-malone-mimosa-cardamom,import_images/jo-malone-mimosa-cardamom/1.avif,1,1,Jo Malone Mimosa & Cardamom фото 1
jo-malone-myrrh-tonka,import_images/jo-malone-myrrh-tonka/1.avif,1,1,Jo Malone Myrrh & Tonka фото 1
jo-malone-nectarine-blossom-honey,import_images/jo-malone-nectarine-blossom-honey/1.avif,1,1,Jo Malone Nectarine Blossom & Honey фото 1
jo-malone-orange-blossom,import_images/jo-malone-orange-blossom/1.avif,1,1,Jo Malone Orange Blossom фото 1
jo-malone-oud-bergamot-intense,import_images/jo-malone-oud-bergamot-intense/1.avif,1,1,Jo Malone Oud & Bergamot Intense фото 1
jo-malone-pomegranate-noir,import_images/jo-malone-pomegranate-noir/1.avif,1,1,Jo Malone Pomegranate Noir фото 1
jo-malone-poppy-barley,import_images/jo-malone-poppy-barley/1.avif,1,1,Jo Malone Poppy & Barley фото 1
jo-malone-red-roses,import_images/jo-malone-red-roses/1.avif,1,1,Jo Malone Red Roses фото 1
jo-malone-scarlet-poppy-intense,import_images/jo-malone-scarlet-poppy-intense/1.avif,1,1,Jo Malone Scarlet Poppy Intense фото 1
jo-malone-silver-birch-lavender,import_images/jo-malone-silver-birch-lavender/1.avif,1,1,Jo Malone Silver Birch & Lavender фото 1
jo-malone-star-magnolia,import_images/jo-malone-star-magnolia/1.avif,1,1,Jo Malone Star Magnolia фото 1
jo-malone-tuberose-angelica,import_images/jo-malone-tuberose-angelica/1.avif,1,1,Jo Malone Tuberose Angelica фото 1
jo-malone-velvet-rose-oud,import_images/jo-malone-velvet-rose-oud/1.avif,1,1,Jo Malone Velvet Rose & Oud фото 1
jo-malone-whisky-cedarwood,import_images/jo-malone-whisky-cedarwood/1.avif,1,1,Jo Malone Whisky & Cedarwood фото 1
jo-malone-wild-bluebell,import_images/jo-malone-wild-bluebell/1.avif,1,1,Jo Malone Wild Bluebell фото 1
jo-malone-wood-sage-sea-salt,import_images/jo-malone-wood-sage-sea-salt/1.avif,1,1,Jo Malone Wood Sage & Sea Salt фото 1
jo-malone-yuja-cologne,import_images/jo-malone-yuja-cologne/1.avif,1,1,Jo Malone Yuja Cologne фото 1
kajal-almaz,import_images/kajal-almaz/1.avif,1,1,Kajal Almaz фото 1
kajal-dahab,import_images/kajal-dahab/1.avif,1,1,Kajal Dahab фото 1
kajal-jihan,import_images/kajal-jihan/1.avif,1,1,Kajal Jihan фото 1
kajal-lamar,import_images/kajal-lamar/1.avif,1,1,Kajal Lamar фото 1
kilian-angels-share-paradis-eau-de-parfum,import_images/kilian-angels-share-paradis-eau-de-parfum/1.avif,1,1,Kilian Angels' Share Paradis фото 1
kilian-cant-stop-loving-you,import_images/kilian-cant-stop-loving-you/1.avif,1,1,Kilian Can't Stop Loving You фото 1
lancome-climat,import_images/lancome-climat/1.avif,1,1,Lancome Climat фото 1
lancome-jasmins-marzipane,import_images/lancome-jasmins-marzipane/1.avif,1,1,Lancome Jasmins Marzipane фото 1
lancome-la-vie-est-belle,import_images/lancome-la-vie-est-belle/1.avif,1,1,Lancome La Vie Est Belle фото 1
lancome-la-vie-est-belle-en-rose,import_images/lancome-la-vie-est-belle-en-rose/1.avif,1,1,Lancome La Vie Est Belle En Rose фото 1
lancome-la-vie-est-belle-intense,import_images/lancome-la-vie-est-belle-intense/1.avif,1,1,Lancome La Vie Est Belle Intense фото 1
lancome-la-vie-est-belle-intensment,import_images/lancome-la-vie-est-belle-intensment/1.avif,1,1,Lancome La Vie Est Belle Intensément фото 1
lancome-la-vie-est-belle-l-eau-de-toilette-florale,import_images/lancome-la-vie-est-belle-l-eau-de-toilette-florale/1.avif,1,1,Lancome La Vie Est Belle L Eau de Toilette Florale фото 1
lancome-la-vie-est-belle-lclat,import_images/lancome-la-vie-est-belle-lclat/1.avif,1,1,Lancome La Vie Est Belle L'Éclat фото 1
lancome-la-vie-est-belle-leau-de-parfum-legere,import_images/lancome-la-vie-est-belle-leau-de-parfum-legere/1.avif,1,1,Lancome La Vie Est Belle L`Eau de Parfum Legere фото 1
lancome-la-vie-est-belle-soleil-cristal,import_images/lancome-la-vie-est-belle-soleil-cristal/1.avif,1,1,Lancome La Vie Est Belle Soleil Cristal фото 1
lancome-magie-noire,import_images/lancome-magie-noire/1.avif,1,1,Lancome Magie Noire фото 1
lancome-miracle,import_images/lancome-miracle/1.avif,1,1,Lancome Miracle фото 1
lancome-miracle-blossom,import_images/lancome-miracle-blossom/1.avif,1,1,Lancome Miracle Blossom фото 1
lancome-miracle-forever,import_images/lancome-miracle-forever/1.avif,1,1,Lancome Miracle Forever фото 1
lancome-miracle-secret,import_images/lancome-miracle-secret/1.avif,1,1,Lancome Miracle Secret фото 1
lancome-oud-bouquet,import_images/lancome-oud-bouquet/1.avif,1,1,Lancome Oud Bouquet фото 1
lancome-oui-la-vie-est-belle,import_images/lancome-oui-la-vie-est-belle/1.avif,1,1,Lancome Oui La Vie Est Belle фото 1
lancome-parfait-de-roses,import_images/lancome-parfait-de-roses/1.avif,1,1,Lancome Parfait de Roses фото 1
le-labo-ambrette-9-perf,import_images/le-labo-ambrette-9-perf/1.avif,1,1,Le Labo Ambrette 9 фото 1
le-labo-another-13-perf,import_images/le-labo-another-13-perf/1.avif,1,1,Le Labo Another 13 фото 1
le-labo-baie-19-perf,import_images/le-labo-baie-19-perf/1.avif,1,1,Le Labo Baie 19 фото 1
le-labo-benjoin-19-moscow-perf,import_images/le-labo-benjoin-19-moscow-perf/1.avif,1,1,Le Labo Benjoin 19 Moscow фото 1
le-labo-benjoin-19-perf,import_images/le-labo-benjoin-19-perf/1.avif,1,1,Le Labo Benjoin 19 фото 1
le-labo-bergamote-22-perf,import_images/le-labo-bergamote-22-perf/1.avif,1,1,Le Labo Bergamote 22 фото 1
le-labo-gaiac-10-perf,import_images/le-labo-gaiac-10-perf/1.avif,1,1,Le Labo Gaiac 10 фото 1
le-labo-iris-39-perf,import_images/le-labo-iris-39-perf/1.avif,1,1,Le Labo Iris 39 фото 1
le-labo-jasmin-17-perf,import_images/le-labo-jasmin-17-perf/1.avif,1,1,Le Labo Jasmin 17 фото 1
le-labo-lys-41-perf,import_images/le-labo-lys-41-perf/1.avif,1,1,Le Labo Lys 41 фото 1
le-labo-musc-25-perf,import_images/le-labo-musc-25-perf/1.avif,1,1,Le Labo Musc 25 фото 1
le-labo-neroli-36-perf,import_images/le-labo-neroli-36-perf/1.avif,1,1,Le Labo Neroli 36 фото 1
le-labo-oud-27-perf,import_images/le-labo-oud-27-perf/1.avif,1,1,Le Labo Oud 27 фото 1
le-labo-patchouli-24-perf,import_images/le-labo-patchouli-24-perf/1.avif,1,1,Le Labo Patchouli 24 фото 1
le-labo-poivre-23-perf,import_images/le-labo-poivre-23-perf/1.avif,1,1,Le Labo Poivre 23 фото 1
le-labo-santal-33-perf,import_images/le-labo-santal-33-perf/1.avif,1,1,Le Labo Santal 33 фото 1
le-labo-tonka-25-perf,import_images/le-labo-tonka-25-perf/1.avif,1,1,Le Labo Tonka 25 фото 1
le-labo-ylang-49-perf,import_images/le-labo-ylang-49-perf/1.avif,1,1,Le Labo Ylang 49 фото 1
louis-vuitton-afternoon-swim,import_images/louis-vuitton-afternoon-swim/1.avif,1,1,Louis Vuitton Afternoon Swim фото 1
louis-vuitton-au-hasard,import_images/louis-vuitton-au-hasard/1.avif,1,1,Louis Vuitton Au Hasard фото 1
louis-vuitton-california-dream,import_images/louis-vuitton-california-dream/1.avif,1,1,Louis Vuitton California Dream фото 1
louis-vuitton-city-of-stars,import_images/louis-vuitton-city-of-stars/1.avif,1,1,Louis Vuitton City of Stars фото 1
louis-vuitton-contre-moi,import_images/louis-vuitton-contre-moi/1.avif,1,1,Louis Vuitton Contre Moi фото 1
louis-vuitton-dans-la-peau,import_images/louis-vuitton-dans-la-peau/1.avif,1,1,Louis Vuitton Dans la Peau фото 1
louis-vuitton-heures-dabsence,import_images/louis-vuitton-heures-dabsence/1.avif,1,1,Louis Vuitton Heures D'Absence фото 1
louis-vuitton-imagination,import_images/louis-vuitton-imagination/1.avif,1,1,Louis Vuitton Imagination фото 1
louis-vuitton-les-sables-roses,import_images/louis-vuitton-les-sables-roses/1.avif,1,1,Louis Vuitton Les Sables Roses фото 1
louis-vuitton-mille-feux,import_images/louis-vuitton-mille-feux/1.avif,1,1,Louis Vuitton Mille Feux фото 1
louis-vuitton-nuit-de-feu,import_images/louis-vuitton-nuit-de-feu/1.avif,1,1,Louis Vuitton Nuit De Feu фото 1
louis-vuitton-ombre-nomade,import_images/louis-vuitton-ombre-nomade/1.avif,1,1,Louis Vuitton Ombre Nomade фото 1
louis-vuitton-orage,import_images/louis-vuitton-orage/1.avif,1,1,Louis Vuitton Orage фото 1
louis-vuitton-pacific-chill,import_images/louis-vuitton-pacific-chill/1.avif,1,1,Louis Vuitton Pacific Chill фото 1
louis-vuitton-rose-des-vents,import_images/louis-vuitton-rose-des-vents/1.avif,1,1,Louis Vuitton Rose des Vents фото 1
louis-vuitton-spell-on-you,import_images/louis-vuitton-spell-on-you/1.avif,1,1,Louis Vuitton Spell On You фото 1
louis-vuitton-sun-song,import_images/louis-vuitton-sun-song/1.avif,1,1,Louis Vuitton Sun Song фото 1
marc-antoine-barrois-b683,import_images/marc-antoine-barrois-b683/1.avif,1,1,Marc-Antoine Barrois B683 фото 1
marc-antoine-barrois-b683-extrait,import_images/marc-antoine-barrois-b683-extrait/1.avif,1,1,Marc-Antoine Barrois B683 Extrait фото 1
marc-antoine-barrois-encelade,import_images/marc-antoine-barrois-encelade/1.avif,1,1,Marc-Antoine Barrois Encelade фото 1
marc-antoine-barrois-ganymede,import_images/marc-antoine-barrois-ganymede/1.avif,1,1,Marc-Antoine Barrois Ganymede фото 1
marc-antoine-barrois-ganymede-extrait,import_images/marc-antoine-barrois-ganymede-extrait/1.avif,1,1,Marc-Antoine Barrois Ganymede Extrait фото 1
marc-jacobs-bang,import_images/marc-jacobs-bang/1.avif,1,1,Marc Jacobs Bang фото 1
marc-jacobs-bang-bang,import_images/marc-jacobs-bang-bang/1.avif,1,1,Marc Jacobs Bang Bang фото 1
marc-jacobs-daisy-dream,import_images/marc-jacobs-daisy-dream/1.avif,1,1,Marc Jacobs Daisy Dream фото 1
marc-jacobs-daisy-dream-daze,import_images/marc-jacobs-daisy-dream-daze/1.avif,1,1,Marc Jacobs Daisy Dream Daze фото 1
marc-jacobs-daisy-dream-forever,import_images/marc-jacobs-daisy-dream-forever/1.avif,1,1,Marc Jacobs Daisy Dream Forever фото 1
marc-jacobs-daisy-dream-sunshine,import_images/marc-jacobs-daisy-dream-sunshine/1.avif,1,1,Marc Jacobs Daisy Dream Sunshine фото 1
marc-jacobs-daisy-eau-de-parfum,import_images/marc-jacobs-daisy-eau-de-parfum/1.avif,1,1,Marc Jacobs Daisy eau de Parfum фото 1
marc-jacobs-daisy-eau-de-toilette,import_images/marc-jacobs-daisy-eau-de-toilette/1.avif,1,1,Marc Jacobs Daisy eau de Toilette фото 1
marc-jacobs-daisy-eau-so-fresh,import_images/marc-jacobs-daisy-eau-so-fresh/1.avif,1,1,Marc Jacobs Daisy Eau So Fresh фото 1
marc-jacobs-daisy-eau-so-fresh-daze,import_images/marc-jacobs-daisy-eau-so-fresh-daze/1.avif,1,1,Marc Jacobs Daisy Eau So Fresh Daze фото 1
marc-jacobs-daisy-eau-so-fresh-kiss,import_images/marc-jacobs-daisy-eau-so-fresh-kiss/1.avif,1,1,Marc Jacobs Daisy Eau So Fresh Kiss фото 1
marc-jacobs-daisy-eau-so-intense,import_images/marc-jacobs-daisy-eau-so-intense/1.avif,1,1,Marc Jacobs Daisy Eau So Intense фото 1
marc-jacobs-daisy-kiss,import_images/marc-jacobs-daisy-kiss/1.avif,1,1,Marc Jacobs Daisy Kiss фото 1
marc-jacobs-daisy-love,import_images/marc-jacobs-daisy-love/1.avif,1,1,Marc Jacobs Daisy Love фото 1
marc-jacobs-daisy-twinkle,import_images/marc-jacobs-daisy-twinkle/1.avif,1,1,Marc Jacobs Daisy Twinkle фото 1
marc-jacobs-decadence,import_images/marc-jacobs-decadence/1.avif,1,1,Marc Jacobs Decadence фото 1
marc-jacobs-decadence-divine,import_images/marc-jacobs-decadence-divine/1.avif,1,1,Marc Jacobs Decadence Divine фото 1
marc-jacobs-decadence-eau-so-decadent,import_images/marc-jacobs-decadence-eau-so-decadent/1.avif,1,1,Marc Jacobs Decadence Eau So Decadent фото 1
marc-jacobs-dot,import_images/marc-jacobs-dot/1.avif,1,1,Marc Jacobs Dot фото 1
marc-jacobs-honey,import_images/marc-jacobs-honey/1.avif,1,1,Marc Jacobs Honey фото 1
marc-jacobs-lola,import_images/marc-jacobs-lola/1.avif,1,1,Marc Jacobs Lola фото 1
marc-jacobs-perfect,import_images/marc-jacobs-perfect/1.avif,1,1,Marc Jacobs Perfect фото 1
marc-jacobs-perfect-intense,import_images/marc-jacobs-perfect-intense/1.avif,1,1,Marc Jacobs Perfect Intense фото 1
montale-amber-musk,import_images/montale-amber-musk/1.avif,1,1,Montale Amber Musk фото 1
montale-aoud-ambre,import_images/montale-aoud-ambre/1.avif,1,1,Montale Aoud Ambre фото 1
montale-aoud-forest,import_images/montale-aoud-forest/1.avif,1,1,Montale Aoud Forest фото 1
montale-aoud-lagoon,import_images/montale-aoud-lagoon/1.avif,1,1,Montale Aoud Lagoon фото 1
montale-aoud-leather,import_images/montale-aoud-leather/1.avif,1,1,Montale Aoud Leather фото 1
montale-arabians-tonka,import_images/montale-arabians-tonka/1.avif,1,1,Montale Arabians Tonka фото 1
montale-black-aoud,import_images/montale-black-aoud/1.avif,1,1,Montale Black Aoud фото 1
montale-black-aoud-intense,import_images/montale-black-aoud-intense/1.avif,1,1,Montale Black Aoud Intense фото 1
montale-black-musk,import_images/montale-black-musk/1.avif,1,1,Montale Black Musk фото 1
montale-blue-amber,import_images/montale-blue-amber/1.jpg,1,1,Montale Blue Amber фото 1
montale-chocolate-greedy,import_images/montale-chocolate-greedy/1.avif,1,1,Montale Chocolate Greedy фото 1
montale-dark-purple,import_images/montale-dark-purple/1.avif,1,1,Montale Dark Purple фото 1
montale-day-dreams,import_images/montale-day-dreams/1.avif,1,1,Montale Day Dreams фото 1
montale-honey-aoud,import_images/montale-honey-aoud/1.avif,1,1,Montale Honey Aoud фото 1
montale-intense-cafe,import_images/montale-intense-cafe/1.avif,1,1,Montale Intense Cafe фото 1
montale-intense-roses-musk,import_images/montale-intense-roses-musk/1.avif,1,1,Montale Intense Roses Musk фото 1
montale-intense-tiare,import_images/montale-intense-tiare/1.avif,1,1,Montale Intense Tiare фото 1
montale-mango-manga,import_images/montale-mango-manga/1.avif,1,1,Montale Mango Manga фото 1
montale-mukhallat,import_images/montale-mukhallat/1.avif,1,1,Montale Mukhallat фото 1
montale-oud-tobacco,import_images/montale-oud-tobacco/1.avif,1,1,Montale Oud Tobacco фото 1
montale-oudmazing,import_images/montale-oudmazing/1.avif,1,1,Montale Oudmazing фото 1
montale-patchouli-leaves,import_images/montale-patchouli-leaves/1.avif,1,1,Montale Patchouli Leaves фото 1
montale-red-vetiver,import_images/montale-red-vetiver/1.avif,1,1,Montale Red Vetiver фото 1
montale-ristretto-intense-cafe,import_images/montale-ristretto-intense-cafe/1.avif,1,1,Montale Ristretto Intense Cafe фото 1
montale-roses-musk,import_images/montale-roses-musk/1.jpg,1,1,Montale Roses Musk фото 1
montale-sensual-instinct,import_images/montale-sensual-instinct/1.avif,1,1,Montale Sensual Instinct фото 1
montale-soleil-de-capri,import_images/montale-soleil-de-capri/1.avif,1,1,Montale Soleil de Capri фото 1
montale-starry-nights,import_images/montale-starry-nights/1.avif,1,1,Montale Starry Nights фото 1
montale-sweet-vanilla,import_images/montale-sweet-vanilla/1.avif,1,1,Montale Sweet Vanilla фото 1
montale-tropical-wood,import_images/montale-tropical-wood/1.avif,1,1,Montale Tropical Wood фото 1
montale-vanille-absolu,import_images/montale-vanille-absolu/1.avif,1,1,Montale Vanille Absolu фото 1
montale-white-aoud,import_images/montale-white-aoud/1.avif,1,1,Montale White Aoud фото 1
montale-wild-pears,import_images/montale-wild-pears/1.avif,1,1,Montale Wild Pears фото 1
montale-wood-spices,import_images/montale-wood-spices/1.avif,1,1,Montale Wood & Spices фото 1
muzhskie-dukhi-bvlgari-man-in-black-parfum,import_images/muzhskie-dukhi-bvlgari-man-in-black-parfum/1.avif,1,1,Bvlgari Man In Black Parfum фото 1
muzhskie-dukhi-bvlgari-man-rain-essence,import_images/muzhskie-dukhi-bvlgari-man-rain-essence/1.avif,1,1,Bvlgari Man Rain Essence фото 1
muzhskie-dukhi-carolina-herrera-212-vip-men-wins,import_images/muzhskie-dukhi-carolina-herrera-212-vip-men-wins/1.avif,1,1,Carolina Herrera 212 VIP Men Wins фото 1
muzhskie-dukhi-carolina-herrera-bad-boy-cobalt-elixir,import_images/muzhskie-dukhi-carolina-herrera-bad-boy-cobalt-elixir/1.avif,1,1,Carolina Herrera Bad Boy Cobalt Elixir фото 1
muzhskie-dukhi-carolina-herrera-bad-boy-cobalt-parfum-electrique,import_images/muzhskie-dukhi-carolina-herrera-bad-boy-cobalt-parfum-electrique/1.avif,1,1,Carolina Herrera Bad Boy Cobalt Parfum Electrique фото 1
muzhskie-dukhi-carolina-herrera-bad-boy-dazzling-garden,import_images/muzhskie-dukhi-carolina-herrera-bad-boy-dazzling-garden/1.avif,1,1,Carolina Herrera Bad Boy Dazzling Garden фото 1
muzhskie-dukhi-carolina-herrera-ch-men-hot-hot-hot,import_images/muzhskie-dukhi-carolina-herrera-ch-men-hot-hot-hot/1.avif,1,1,Carolina Herrera CH Men Hot! Hot! Hot! фото 1
muzhskie-dukhi-carolina-herrera-ch-men-under-the-sea,import_images/muzhskie-dukhi-carolina-herrera-ch-men-under-the-sea/1.avif,1,1,Carolina Herrera CH Men Under The Sea фото 1
muzhskie-dukhi-creed-absolu-aventus,import_images/muzhskie-dukhi-creed-absolu-aventus/1.avif,1,1,Creed Absolu Aventus фото 1
muzhskie-dukhi-dior-fahrenheit-cologne,import_images/muzhskie-dukhi-dior-fahrenheit-cologne/1.avif,1,1,Dior Fahrenheit Cologne фото 1
muzhskie-dukhi-frederic-malle-uncut-gem,import_images/muzhskie-dukhi-frederic-malle-uncut-gem/1.avif,1,1,Frederic Malle Uncut Gem фото 1
muzhskie-dukhi-giorgio-armani-acqua-di-gi-profondo-parfum,import_images/muzhskie-dukhi-giorgio-armani-acqua-di-gi-profondo-parfum/1.avif,1,1,Giorgio Armani Acqua di Giò Profondo Parfum фото 1
muzhskie-dukhi-giorgio-armani-code-parfum,import_images/muzhskie-dukhi-giorgio-armani-code-parfum/1.avif,1,1,Giorgio Armani Code Parfum фото 1
muzhskie-dukhi-giorgio-armani-emporio-armani-stronger-with-you-leather,import_images/muzhskie-dukhi-giorgio-armani-emporio-armani-stronger-with-you-leather/1.avif,1,1,Giorgio Armani Emporio Armani Stronger With You Leather фото 1
muzhskie-dukhi-giorgio-armani-emporio-armani-stronger-with-you-tobacco,import_images/muzhskie-dukhi-giorgio-armani-emporio-armani-stronger-with-you-tobacco/1.avif,1,1,Giorgio Armani Emporio Armani Stronger With You Tobacco фото 1
muzhskie-dukhi-givenchy-gentleman-society-eau-de-parfum-extrme,import_images/muzhskie-dukhi-givenchy-gentleman-society-eau-de-parfum-extrme/1.avif,1,1,Givenchy Gentleman Society Eau de Parfum Extrême фото 1
muzhskie-dukhi-givenchy-gentlemen-only-fraiche,import_images/muzhskie-dukhi-givenchy-gentlemen-only-fraiche/1.avif,1,1,Givenchy Gentlemen Only Fraiche фото 1
muzhskie-dukhi-hermes-h24-herbes-vives,import_images/muzhskie-dukhi-hermes-h24-herbes-vives/1.avif,1,1,Hermes H24 Herbes Vives фото 1
muzhskie-dukhi-jean-paul-gaultier-le-beau-paradise-garden,import_images/muzhskie-dukhi-jean-paul-gaultier-le-beau-paradise-garden/1.avif,1,1,Jean Paul Gaultier Le Beau Paradise Garden фото 1
muzhskie-dukhi-jean-paul-gaultier-le-male-elixir,import_images/muzhskie-dukhi-jean-paul-gaultier-le-male-elixir/1.avif,1,1,Jean Paul Gaultier Le Male Elixir фото 1
muzhskie-dukhi-jean-paul-gaultier-scandal-pour-homme-le-parfum,import_images/muzhskie-dukhi-jean-paul-gaultier-scandal-pour-homme-le-parfum/1.avif,1,1,Jean Paul Gaultier Scandal Pour Homme Le Parfum фото 1
muzhskie-dukhi-louis-vuitton-nouveau-monde,import_images/muzhskie-dukhi-louis-vuitton-nouveau-monde/1.avif,1,1,Louis Vuitton Nouveau Monde фото 1
muzhskie-dukhi-louis-vuitton-sur-la-route,import_images/muzhskie-dukhi-louis-vuitton-sur-la-route/1.avif,1,1,Louis Vuitton Sur la Route фото 1
muzhskie-dukhi-paco-rabanne-1-million-golden-oud,import_images/muzhskie-dukhi-paco-rabanne-1-million-golden-oud/1.avif,1,1,Paco Rabanne 1 Million Golden Oud фото 1
muzhskie-dukhi-paco-rabanne-invictus-parfum,import_images/muzhskie-dukhi-paco-rabanne-invictus-parfum/1.avif,1,1,Paco Rabanne Invictus Parfum фото 1
muzhskie-dukhi-paco-rabanne-pour-homme,import_images/muzhskie-dukhi-paco-rabanne-pour-homme/1.avif,1,1,Paco Rabanne Pour Homme фото 1
muzhskie-dukhi-roja-dove-elysium-pour-homme-eau-intense,import_images/muzhskie-dukhi-roja-dove-elysium-pour-homme-eau-intense/1.avif,1,1,Roja Dove Elysium Pour Homme Eau Intense фото 1
muzhskie-dukhi-roja-dove-enigma-pour-homme-parfum-cologne,import_images/muzhskie-dukhi-roja-dove-enigma-pour-homme-parfum-cologne/1.avif,1,1,Roja Dove Enigma Pour Homme Parfum Cologne фото 1
muzhskie-dukhi-roja-dove-scandal-pour-homme-parfum-cologne,import_images/muzhskie-dukhi-roja-dove-scandal-pour-homme-parfum-cologne/1.avif,1,1,Roja Dove Scandal Pour Homme Parfum Cologne фото 1
muzhskie-dukhi-tom-ford-grey-vetiver-parfum,import_images/muzhskie-dukhi-tom-ford-grey-vetiver-parfum/1.avif,1,1,Tom Ford Grey Vetiver Parfum фото 1
muzhskie-dukhi-tom-ford-noir-extreme-parfum,import_images/muzhskie-dukhi-tom-ford-noir-extreme-parfum/1.avif,1,1,Tom Ford Noir Extreme Parfum фото 1
muzhskie-dukhi-yves-saint-laurent-la-nuit-de-lhomme-bleu-lectrique,import_images/muzhskie-dukhi-yves-saint-laurent-la-nuit-de-lhomme-bleu-lectrique/1.avif,1,1,Yves Saint Laurent La Nuit de L'Homme Bleu Électrique фото 1
