product_slug,image_path,is_main,sort_order,alt
amouage-ashore,import_images/amouage-ashore/1.avif,1,1,Amouage Ashore фото 1
amouage-beach-hut,import_images/amouage-beach-hut/1.avif,1,1,Amouage Beach Hut фото 1
amouage-beach-hut-men,import_images/amouage-beach-hut-men/1.avif,1,1,Amouage Beach Hut Men фото 1
amouage-blossom-love,import_images/amouage-blossom-love/1.avif,1,1,Amouage Blossom Love фото 1
amouage-guidance,import_images/amouage-guidance/1.avif,1,1,Amouage Guidance фото 1
amouage-honour-43-woman,import_images/amouage-honour-43-woman/1.avif,1,1,Amouage Honour 43 Woman фото 1
amouage-honour-man,import_images/amouage-honour-man/1.avif,1,1,Amouage Honour man фото 1
amouage-honour-woman,import_images/amouage-honour-woman/1.avif,1,1,Amouage Honour woman фото 1
amouage-imitation-man,import_images/amouage-imitation-man/1.avif,1,1,Amouage Imitation man фото 1
amouage-imitation-woman,import_images/amouage-imitation-woman/1.avif,1,1,Amouage Imitation woman фото 1
amouage-interlude-53,import_images/amouage-interlude-53/1.avif,1,1,Amouage Interlude 53 фото 1
amouage-interlude-black-iris-man,import_images/amouage-interlude-black-iris-man/1.avif,1,1,Amouage Interlude Black Iris Man фото 1
amouage-interlude-man,import_images/amouage-interlude-man/1.avif,1,1,Amouage Interlude man фото 1
amouage-interlude-woman,import_images/amouage-interlude-woman/1.avif,1,1,Amouage Interlude woman фото 1
amouage-journey-man,import_images/amouage-journey-man/1.avif,1,1,Amouage Journey Man фото 1
amouage-journey-woman,import_images/amouage-journey-woman/1.avif,1,1,Amouage Journey woman фото 1
amouage-jubilation-25-woman,import_images/amouage-jubilation-25-woman/1.avif,1,1,Amouage Jubilation 25 woman фото 1
amouage-lilac-love,import_images/amouage-lilac-love/1.avif,1,1,Amouage Lilac Love фото 1
amouage-lineage,import_images/amouage-lineage/1.avif,1,1,Amouage Lineage фото 1
amouage-love-mimosa,import_images/amouage-love-mimosa/1.avif,1,1,Amouage Love Mimosa фото 1
amouage-love-tuberose,import_images/amouage-love-tuberose/1.avif,1,1,Amouage Love Tuberose фото 1
amouage-lustre,import_images/amouage-lustre/1.avif,1,1,Amouage Lustre фото 1
amouage-lyric-man,import_images/amouage-lyric-man/1.avif,1,1,Amouage Lyric man фото 1
amouage-lyric-woman,import_images/amouage-lyric-woman/1.avif,1,1,Amouage Lyric woman фото 1
amouage-material,import_images/amouage-material/1.avif,1,1,Amouage Material фото 1
amouage-myths-men,import_images/amouage-myths-men/1.avif,1,1,Amouage Myths Men фото 1
amouage-myths-woman,import_images/amouage-myths-woman/1.avif,1,1,Amouage Myths Woman фото 1
amouage-opus-vii-reckless-leather,import_images/amouage-opus-vii-reckless-leather/1.avif,1,1,Amouage Opus VII Reckless Leather фото 1
amouage-outlands,import_images/amouage-outlands/1.avif,1,1,Amouage Outlands фото 1
amouage-overture-man,import_images/amouage-overture-man/1.avif,1,1,Amouage Overture Man фото 1
amouage-overture-women,import_images/amouage-overture-women/1.avif,1,1,Amouage Overture Women фото 1
amouage-portrayal-man,import_images/amouage-portrayal-man/1.avif,1,1,Amouage Portrayal Man фото 1
amouage-portrayal-woman,import_images/amouage-portrayal-woman/1.avif,1,1,Amouage Portrayal Woman фото 1
amouage-purpose,import_images/amouage-purpose/1.avif,1,1,Amouage Purpose фото 1
amouage-purpose-50,import_images/amouage-purpose-50/1.avif,1,1,Amouage Purpose 50 фото 1
amouage-reasons,import_images/amouage-reasons/1.avif,1,1,Amouage Reasons фото 1
amouage-reflection-45,import_images/amouage-reflection-45/1.avif,1,1,Amouage Reflection 45 фото 1
amouage-reflection-man,import_images/amouage-reflection-man/1.avif,1,1,Amouage Reflection man фото 1
amouage-reflection-woman,import_images/amouage-reflection-woman/1.avif,1,1,Amouage Reflection woman фото 1
amouage-search,import_images/amouage-search/1.avif,1,1,Amouage Search фото 1
amouage-sunshine-man,import_images/amouage-sunshine-man/1.avif,1,1,Amouage Sunshine Man фото 1
amouage-sunshine-woman,import_images/amouage-sunshine-woman/1.avif,1,1,Amouage Sunshine woman фото 1
amouage-the-library-collection-opus-v-woods-symphony,import_images/amouage-the-library-collection-opus-v-woods-symphony/1.avif,1,1,Amouage The Library Collection Opus V Woods Symphony фото 1
amouage-the-library-collection-opus-xiv-royal-tobacco,import_images/amouage-the-library-collection-opus-xiv-royal-tobacco/1.avif,1,1,Amouage The Library Collection Opus XIV Royal Tobacco фото 1
bvlgari-allegra-dolce-estasi,import_images/bvlgari-allegra-dolce-estasi/1.avif,1,1,Bvlgari Allegra Dolce Estasi фото 1
bvlgari-aqva-amara,import_images/bvlgari-aqva-amara/1.avif,1,1,Bvlgari Aqva Amara фото 1
bvlgari-aqva-pour-homme,import_images/bvlgari-aqva-pour-homme/1.avif,1,1,Bvlgari Aqva Pour Homme фото 1
bvlgari-aqva-pour-homme-atlantiqve,import_images/bvlgari-aqva-pour-homme-atlantiqve/1.avif,1,1,Bvlgari Aqva Pour Homme Atlantiqve фото 1
bvlgari-aqva-pour-homme-marine,import_images/bvlgari-aqva-pour-homme-marine/1.avif,1,1,Bvlgari Aqva Pour Homme Marine фото 1
bvlgari-aqva-pour-homme-marine-toniq,import_images/bvlgari-aqva-pour-homme-marine-toniq/1.avif,1,1,Bvlgari Aqva Pour Homme Marine Toniq фото 1
bvlgari-aqva-toniq-pour-homme,import_images/bvlgari-aqva-toniq-pour-homme/1.avif,1,1,Bvlgari Aqva Pour Homme Toniq фото 1
bvlgari-blv-pour-homme,import_images/bvlgari-blv-pour-homme/1.avif,1,1,Bvlgari BLV pour Homme фото 1
bvlgari-goldea-the-roman-night,import_images/bvlgari-goldea-the-roman-night/1.avif,1,1,Bvlgari Goldea The Roman Night фото 1
bvlgari-goldea-the-roman-night-absolute,import_images/bvlgari-goldea-the-roman-night-absolute/1.avif,1,1,Bvlgari Goldea The Roman Night Absolute фото 1
bvlgari-jasmin-noir,import_images/bvlgari-jasmin-noir/1.avif,1,1,Bvlgari Jasmin Noir фото 1
bvlgari-le-gemme-gyan,import_images/bvlgari-le-gemme-gyan/1.avif,1,1,Bvlgari Le Gemme Gyan фото 1
bvlgari-man-glacial-essence,import_images/bvlgari-man-glacial-essence/1.avif,1,1,Bvlgari Man Glacial Essence фото 1
bvlgari-man-in-black,import_images/bvlgari-man-in-black/1.avif,1,1,Bvlgari Man In Black фото 1
bvlgari-man-terrae-essence,import_images/bvlgari-man-terrae-essence/1.avif,1,1,Bvlgari Man Terrae Essence фото 1
bvlgari-man-wood-essence,import_images/bvlgari-man-wood-essence/1.avif,1,1,Bvlgari Man Wood Essence фото 1
bvlgari-mon-jasmin-noir,import_images/bvlgari-mon-jasmin-noir/1.avif,1,1,Bvlgari Mon Jasmin Noir фото 1
bvlgari-mon-jasmin-noir-leau-exquise,import_images/bvlgari-mon-jasmin-noir-leau-exquise/1.avif,1,1,Bvlgari Mon Jasmin Noir L`Eau Exquise фото 1
bvlgari-omnia-amethyste,import_images/bvlgari-omnia-amethyste/1.avif,1,1,Bvlgari Omnia Amethyste фото 1
bvlgari-omnia-coral,import_images/bvlgari-omnia-coral/1.avif,1,1,Bvlgari Omnia Coral фото 1
bvlgari-omnia-crystalline,import_images/bvlgari-omnia-crystalline/1.avif,1,1,Bvlgari Omnia Crystalline фото 1
bvlgari-omnia-crystalline-leau-de-parfum,import_images/bvlgari-omnia-crystalline-leau-de-parfum/1.avif,1,1,Bvlgari Omnia Crystalline L`Eau de Parfum фото 1
bvlgari-omnia-indian-garnet,import_images/bvlgari-omnia-indian-garnet/1.avif,1,1,Bvlgari Omnia Indian Garnet фото 1
bvlgari-omnia-paraiba,import_images/bvlgari-omnia-paraiba/1.avif,1,1,Bvlgari Omnia Paraiba фото 1
bvlgari-omnia-pink-sapphire,import_images/bvlgari-omnia-pink-sapphire/1.avif,1,1,Bvlgari Omnia Pink Sapphire фото 1
bvlgari-petits-et-mamans,import_images/bvlgari-petits-et-mamans/1.avif,1,1,Bvlgari Petits et Mamans фото 1
bvlgari-rose-goldea,import_images/bvlgari-rose-goldea/1.avif,1,1,Bvlgari Rose Goldea фото 1
bvlgari-rose-goldea-blossom-delight,import_images/bvlgari-rose-goldea-blossom-delight/1.avif,1,1,Bvlgari Rose Goldea Blossom Delight фото 1
bvlgari-rose-goldea-blossom-delight-eau-de-toilette,import_images/bvlgari-rose-goldea-blossom-delight-eau-de-toilette/1.avif,1,1,Bvlgari Rose Goldea Blossom Delight Eau de Toilette фото 1
bvlgari-splendida-jasmin-noir,import_images/bvlgari-splendida-jasmin-noir/1.avif,1,1,Bvlgari Splendida Jasmin Noir фото 1
bvlgari-splendida-magnolia-sensuel,import_images/bvlgari-splendida-magnolia-sensuel/1.avif,1,1,Bvlgari Splendida Magnolia Sensuel фото 1
bvlgari-splendida-rose-rose,import_images/bvlgari-splendida-rose-rose/1.avif,1,1,Bvlgari Splendida Rose Rose фото 1
byredo,import_images/byredo/1.avif,1,1,Byredo Mojave Ghost Absolu фото 1
byredo-bal-dafrique,import_images/byredo-bal-dafrique/1.avif,1,1,Byredo Bal d'Afrique фото 1
byredo-black-saffron,import_images/byredo-black-saffron/1.avif,1,1,Byredo Black Saffron фото 1
byredo-blanche,import_images/byredo-blanche/1.avif,1,1,Byredo Blanche фото 1
byredo-blanche-absolu,import_images/byredo-blanche-absolu/1.avif,1,1,Byredo Blanche Absolu фото 1
byredo-de-los-santos,import_images/byredo-de-los-santos/1.avif,1,1,Byredo De Los Santos фото 1
byredo-eleventh-hour,import_images/byredo-eleventh-hour/1.avif,1,1,Byredo Eleventh Hour фото 1
byredo-flowerhead,import_images/byredo-flowerhead/1.avif,1,1,Byredo Flowerhead фото 1
byredo-gypsy-water,import_images/byredo-gypsy-water/1.avif,1,1,Byredo Gypsy Water фото 1
byredo-inflorescence,import_images/byredo-inflorescence/1.avif,1,1,Byredo Inflorescence фото 1
byredo-la-tulipe,import_images/byredo-la-tulipe/1.avif,1,1,Byredo La Tulipe фото 1
byredo-lil-fleur,import_images/byredo-lil-fleur/1.avif,1,1,Byredo Lil Fleur фото 1
byredo-lil-fleur-amber,import_images/byredo-lil-fleur-amber/1.avif,1,1,Byredo Lil Fleur Amber фото 1
byredo-lil-fleur-blond-wood,import_images/byredo-lil-fleur-blond-wood/1.avif,1,1,Byredo Lil Fleur Blond Wood фото 1
byredo-lil-fleur-cassis,import_images/byredo-lil-fleur-cassis/1.avif,1,1,Byredo Lil Fleur Cassis фото 1
byredo-lil-fleur-rose,import_images/byredo-lil-fleur-rose/1.jpg,1,1,Byredo Lil Fleur Rose фото 1
byredo-lil-fleur-saffron,import_images/byredo-lil-fleur-saffron/1.avif,1,1,Byredo Lil Fleur Saffron фото 1
byredo-lil-fleur-tangerine,import_images/byredo-lil-fleur-tangerine/1.avif,1,1,Byredo Lil Fleur Tangerine фото 1
byredo-mister-marvelous,import_images/byredo-mister-marvelous/1.avif,1,1,Byredo Mister Marvelous фото 1
byredo-mixed-emotions,import_images/byredo-mixed-emotions/1.avif,1,1,Byredo Mixed Emotions фото 1
byredo-mojave-ghost,import_images/byredo-mojave-ghost/1.avif,1,1,Byredo Mojave Ghost фото 1
byredo-open-sky,import_images/byredo-open-sky/1.avif,1,1,Byredo Open Sky фото 1
byredo-oud-immortel,import_images/byredo-oud-immortel/1.avif,1,1,Byredo Oud Immortel фото 1
byredo-pulp,import_images/byredo-pulp/1.avif,1,1,Byredo Pulp фото 1
byredo-reine-de-nuit-2019,import_images/byredo-reine-de-nuit-2019/1.avif,1,1,Byredo Reine de Nuit (2019) фото 1
byredo-sellier,import_images/byredo-sellier/1.avif,1,1,Byredo Sellier фото 1
byredo-slow-dance,import_images/byredo-slow-dance/1.avif,1,1,Byredo Slow Dance фото 1
byredo-sundazed,import_images/byredo-sundazed/1.avif,1,1,Byredo Sundazed фото 1
byredo-super-cedar,import_images/byredo-super-cedar/1.avif,1,1,Byredo Super Cedar фото 1
byredo-tobacco-mandarin,import_images/byredo-tobacco-mandarin/1.avif,1,1,Byredo Tobacco Mandarin фото 1
byredo-young-rose,import_images/byredo-young-rose/1.avif,1,1,Byredo Young Rose фото 1
carolina-herrera-212-heroes-forever-young,import_images/carolina-herrera-212-heroes-forever-young/1.avif,1,1,Carolina Herrera 212 Heroes Forever Young фото 1
carolina-herrera-212-sexy,import_images/carolina-herrera-212-sexy/1.avif,1,1,Carolina Herrera 212 Sexy фото 1
carolina-herrera-212-sexy-men,import_images/carolina-herrera-212-sexy-men/1.avif,1,1,Carolina Herrera 212 Sexy Men фото 1
carolina-herrera-212-vip-black,import_images/carolina-herrera-212-vip-black/1.avif,1,1,Carolina Herrera 212 VIP Black фото 1
carolina-herrera-212-vip-black-elixir,import_images/carolina-herrera-212-vip-black-elixir/1.avif,1,1,Carolina Herrera 212 VIP Black Elixir фото 1
carolina-herrera-212-vip-black-red,import_images/carolina-herrera-212-vip-black-red/1.avif,1,1,Carolina Herrera 212 VIP Black Red фото 1
carolina-herrera-212-vip-men,import_images/carolina-herrera-212-vip-men/1.avif,1,1,Carolina Herrera 212 Vip Men фото 1
carolina-herrera-212-vip-men-party-fever,import_images/carolina-herrera-212-vip-men-party-fever/1.avif,1,1,Carolina Herrera 212 VIP Men Party Fever фото 1
carolina-herrera-212-vip-party-fever,import_images/carolina-herrera-212-vip-party-fever/1.avif,1,1,Carolina Herrera 212 VIP Party Fever фото 1
carolina-herrera-212-vip-wild-party,import_images/carolina-herrera-212-vip-wild-party/1.avif,1,1,Carolina Herrera 212 VIP Wild Party фото 1
carolina-herrera-212-vip-wild-party-men,import_images/carolina-herrera-212-vip-wild-party-men/1.avif,1,1,Carolina Herrera 212 VIP Wild Party Men фото 1
carolina-herrera-bad-boy,import_images/carolina-herrera-bad-boy/1.avif,1,1,Carolina Herrera Bad Boy фото 1
carolina-herrera-bad-boy-cobalt,import_images/carolina-herrera-bad-boy-cobalt/1.avif,1,1,Carolina Herrera Bad Boy Cobalt фото 1
carolina-herrera-bad-boy-extreme,import_images/carolina-herrera-bad-boy-extreme/1.avif,1,1,Carolina Herrera Bad Boy Extreme фото 1
carolina-herrera-bad-boy-le-parfum,import_images/carolina-herrera-bad-boy-le-parfum/1.avif,1,1,Carolina Herrera Bad Boy Le Parfum фото 1
carolina-herrera-bergamot-bloom,import_images/carolina-herrera-bergamot-bloom/1.avif,1,1,Carolina Herrera Bergamot Bloom фото 1
carolina-herrera-burning-rose,import_images/carolina-herrera-burning-rose/1.avif,1,1,Carolina Herrera Burning Rose фото 1
carolina-herrera-ch-men,import_images/carolina-herrera-ch-men/1.avif,1,1,Carolina Herrera CH Men фото 1
carolina-herrera-ch-men-prive,import_images/carolina-herrera-ch-men-prive/1.avif,1,1,Carolina Herrera CH Men Prive фото 1
carolina-herrera-gold-myrrh-absolute,import_images/carolina-herrera-gold-myrrh-absolute/1.avif,1,1,Carolina Herrera Gold Myrrh Absolute фото 1
carolina-herrera-good-girl,import_images/carolina-herrera-good-girl/1.avif,1,1,Carolina Herrera Good Girl фото 1
carolina-herrera-good-girl-blush,import_images/carolina-herrera-good-girl-blush/1.avif,1,1,Carolina Herrera Good Girl Blush фото 1
carolina-herrera-good-girl-dot-drama,import_images/carolina-herrera-good-girl-dot-drama/1.avif,1,1,Carolina Herrera Good Girl Dot Drama фото 1
carolina-herrera-good-girl-fantastic-pink,import_images/carolina-herrera-good-girl-fantastic-pink/1.avif,1,1,Carolina Herrera Good Girl Fantastic Pink фото 1
carolina-herrera-good-girl-legere,import_images/carolina-herrera-good-girl-legere/1.avif,1,1,Carolina Herrera Good Girl Legere фото 1
carolina-herrera-good-girl-supreme,import_images/carolina-herrera-good-girl-supreme/1.avif,1,1,Carolina Herrera Good Girl Supreme фото 1
carolina-herrera-good-girl-velvet-fatale,import_images/carolina-herrera-good-girl-velvet-fatale/1.avif,1,1,Carolina Herrera Good Girl Velvet Fatale фото 1
carolina-herrera-iris-empire,import_images/carolina-herrera-iris-empire/1.avif,1,1,Carolina Herrera Iris Empire фото 1
carolina-herrera-saffron-lazuli,import_images/carolina-herrera-saffron-lazuli/1.avif,1,1,Carolina Herrera Saffron Lazuli фото 1
carolina-herrera-sandal-ruby,import_images/carolina-herrera-sandal-ruby/1.avif,1,1,Carolina Herrera Sandal Ruby фото 1
carolina-herrera-very-good-girl,import_images/carolina-herrera-very-good-girl/1.avif,1,1,Carolina Herrera Very Good Girl фото 1
carolina-herrera-very-good-girl-glam,import_images/carolina-herrera-very-good-girl-glam/1.avif,1,1,Carolina Herrera Very Good Girl Glam фото 1
clive-christian-1872-for-men,import_images/clive-christian-1872-for-men/1.avif,1,1,Clive Christian 1872 for Men фото 1
clive-christian-1872-for-woman,import_images/clive-christian-1872-for-woman/1.avif,1,1,Clive Christian 1872 for Woman фото 1
clive-christian-1872-leather,import_images/clive-christian-1872-leather/1.avif,1,1,Clive Christian 1872 Leather фото 1
clive-christian-1872-masculine,import_images/clive-christian-1872-masculine/1.avif,1,1,Clive Christian 1872 Masculine фото 1
clive-christian-1872-orris,import_images/clive-christian-1872-orris/1.avif,1,1,Clive Christian 1872 Orris фото 1
clive-christian-blonde-amber,import_images/clive-christian-blonde-amber/1.avif,1,1,Clive Christian Blonde Amber фото 1
clive-christian-c-for-men,import_images/clive-christian-c-for-men/1.avif,1,1,Clive Christian C for Men фото 1
clive-christian-c-for-women,import_images/clive-christian-c-for-women/1.avif,1,1,Clive Christian C for Women фото 1
clive-christian-cosmos-flower,import_images/clive-christian-cosmos-flower/1.avif,1,1,Clive Christian Cosmos Flower фото 1
clive-christian-crab-apple-blossom,import_images/clive-christian-crab-apple-blossom/1.avif,1,1,Clive Christian Crab Apple Blossom фото 1
clive-christian-jump-up-and-kiss-me-ecstatic,import_images/clive-christian-jump-up-and-kiss-me-ecstatic/1.avif,1,1,Clive Christian Jump Up And Kiss Me Ecstatic фото 1
clive-christian-jump-up-and-kiss-me-ecstatic-2021,import_images/clive-christian-jump-up-and-kiss-me-ecstatic-2021/1.avif,1,1,Clive Christian Jump Up And Kiss Me Ecstatic 2021 фото 1
clive-christian-jump-up-and-kiss-me-hedonistic,import_images/clive-christian-jump-up-and-kiss-me-hedonistic/1.avif,1,1,Clive Christian Jump up and Kiss Me Hedonistic фото 1
clive-christian-jump-up-and-kiss-me-hedonistic-2021,import_images/clive-christian-jump-up-and-kiss-me-hedonistic-2021/1.avif,1,1,Clive Christian Jump Up And Kiss Me Hedonistic 2021 фото 1
clive-christian-matsukita,import_images/clive-christian-matsukita/1.avif,1,1,Clive Christian Matsukita фото 1
clive-christian-noble-vii-rock-rose,import_images/clive-christian-noble-vii-rock-rose/1.avif,1,1,Clive Christian Noble VII Rock Rose фото 1
clive-christian-x-for-men,import_images/clive-christian-x-for-men/1.avif,1,1,Clive Christian X for Men фото 1
clive-christian-x-for-women,import_images/clive-christian-x-for-women/1.avif,1,1,Clive Christian X for Women фото 1
creed-absolu-aventus-2025,import_images/creed-absolu-aventus-2025/1.avif,1,1,Creed Absolu Aventus 2025 фото 1
creed-acqua-fiorentina,import_images/creed-acqua-fiorentina/1.avif,1,1,Creed Acqua Fiorentina фото 1
creed-acqua-originale-iris-tubereuse,import_images/creed-acqua-originale-iris-tubereuse/1.avif,1,1,Creed Acqua Originale Iris Tubereuse фото 1
creed-acqua-originale-vetiver-geranium,import_images/creed-acqua-originale-vetiver-geranium/1.avif,1,1,Creed Acqua Originale Vetiver Geranium фото 1
creed-aventus,import_images/creed-aventus/1.avif,1,1,Creed Aventus фото 1
creed-aventus-10th-anniversary-limited-edition,import_images/creed-aventus-10th-anniversary-limited-edition/1.avif,1,1,Creed Aventus 10th Anniversary Limited Edition фото 1
creed-aventus-cologne,import_images/creed-aventus-cologne/1.avif,1,1,Creed Aventus Cologne фото 1
creed-aventus-for-her,import_images/creed-aventus-for-her/1.avif,1,1,Creed Aventus For Her фото 1
creed-bois-du-portugal,import_images/creed-bois-du-portugal/1.avif,1,1,Creed Bois du Portugal фото 1
creed-erolfa,import_images/creed-erolfa/1.avif,1,1,Creed Erolfa фото 1
creed-fleurissimo,import_images/creed-fleurissimo/1.avif,1,1,Creed Fleurissimo фото 1
creed-green-irish-tweed,import_images/creed-green-irish-tweed/1.avif,1,1,Creed Green Irish Tweed фото 1
creed-himalaya,import_images/creed-himalaya/1.avif,1,1,Creed Himalaya фото 1
creed-les-royales-exclusives-spice-and-wood,import_images/creed-les-royales-exclusives-spice-and-wood/1.jpg,1,1,Creed Les Royales Exclusives Spice and Wood фото 1
creed-love-in-black,import_images/creed-love-in-black/1.avif,1,1,Creed Love In Black фото 1
creed-love-in-white,import_images/creed-love-in-white/1.avif,1,1,Creed Love In White фото 1
creed-love-in-white-for-summer,import_images/creed-love-in-white-for-summer/1.avif,1,1,Creed Love in White for Summer фото 1
creed-neroli-sauvage,import_images/creed-neroli-sauvage/1.avif,1,1,Creed Neroli Sauvage фото 1
creed-original-vetiver,import_images/creed-original-vetiver/1.avif,1,1,Creed Original Vetiver фото 1
creed-pure-white-cologne,import_images/creed-pure-white-cologne/1.avif,1,1,Creed Pure White Cologne фото 1
creed-royal-mayfair,import_images/creed-royal-mayfair/1.avif,1,1,Creed Royal Mayfair фото 1
creed-royal-oud,import_images/creed-royal-oud/1.avif,1,1,Creed Royal Oud фото 1
creed-royal-princess-oud,import_images/creed-royal-princess-oud/1.avif,1,1,Creed Royal Princess Oud фото 1
creed-royal-water,import_images/creed-royal-water/1.avif,1,1,Creed Royal Water фото 1
creed-silver-mountain-water,import_images/creed-silver-mountain-water/1.avif,1,1,Creed Silver Mountain Water фото 1
creed-spring-flower,import_images/creed-spring-flower/1.avif,1,1,Creed Spring Flower фото 1
creed-tabarome,import_images/creed-tabarome/1.avif,1,1,Creed Tabarome фото 1
creed-viking,import_images/creed-viking/1.avif,1,1,Creed Viking фото 1
creed-viking-cologne,import_images/creed-viking-cologne/1.avif,1,1,Creed Viking Cologne фото 1
creed-virgin-island-water,import_images/creed-virgin-island-water/1.avif,1,1,Creed Virgin Island Water фото 1
creed-white-flowers,import_images/creed-white-flowers/1.avif,1,1,Creed White Flowers фото 1
creed-wind-flowers,import_images/creed-wind-flowers/1.avif,1,1,Creed Wind Flowers фото 1
dior-addict,import_images/dior-addict/1.avif,1,1,Dior Addict фото 1
dior-addict-2,import_images/dior-addict-2/1.avif,1,1,Dior Addict 2 фото 1
dior-addict-eau-delice,import_images/dior-addict-eau-delice/1.avif,1,1,Dior Addict Eau Delice фото 1
dior-addict-eau-fraiche-2004,import_images/dior-addict-eau-fraiche-2004/1.avif,1,1,Dior Addict Eau Fraiche 2004 фото 1
dior-addict-eau-fraiche-2012,import_images/dior-addict-eau-fraiche-2012/1.avif,1,1,Dior Addict Eau Fraiche фото 1
dior-addict-eau-fraiche-2014,import_images/dior-addict-eau-fraiche-2014/1.avif,1,1,Dior Addict Eau Fraiche 2014 фото 1
dior-addict-eau-sensuelle,import_images/dior-addict-eau-sensuelle/1.avif,1,1,Dior Addict Eau Sensuelle фото 1
dior-addict-shine,import_images/dior-addict-shine/1.avif,1,1,Dior Addict Shine фото 1
dior-aqua-fahrenheit,import_images/dior-aqua-fahrenheit/1.avif,1,1,Dior Aqua Fahrenheit фото 1
dior-diorama,import_images/dior-diorama/1.avif,1,1,Dior Diorama фото 1
dior-dolce-vita,import_images/dior-dolce-vita/1.avif,1,1,Dior Dolce Vita фото 1
dior-dune,import_images/dior-dune/1.avif,1,1,Dior Dune фото 1
dior-dune-pour-homme,import_images/dior-dune-pour-homme/1.avif,1,1,Dior Dune Pour Homme фото 1
dior-eau-de-dolce-vita,import_images/dior-eau-de-dolce-vita/1.avif,1,1,Dior Eau de Dolce Vita фото 1
dior-eau-sauvage-parfum-2012,import_images/dior-eau-sauvage-parfum-2012/1.avif,1,1,Dior Eau Sauvage Parfum (2012) фото 1
dior-eau-sauvage-parfum-2017,import_images/dior-eau-sauvage-parfum-2017/1.avif,1,1,Dior Eau Sauvage Parfum 2017 фото 1
dior-fahrenheit,import_images/dior-fahrenheit/1.avif,1,1,Dior Fahrenheit фото 1
dior-fahrenheit-32,import_images/dior-fahrenheit-32/1.avif,1,1,Dior Fahrenheit 32 фото 1
dior-fahrenheit-le-parfum,import_images/dior-fahrenheit-le-parfum/1.avif,1,1,Dior Fahrenheit Le Parfum фото 1
dior-hypnotic-poison-eau-secrete,import_images/dior-hypnotic-poison-eau-secrete/1.avif,1,1,Dior Hypnotic Poison Eau Secrete фото 1
dior-hypnotic-poison-eau-sensuelle,import_images/dior-hypnotic-poison-eau-sensuelle/1.avif,1,1,Dior Hypnotic Poison Eau Sensuelle фото 1
dior-joy,import_images/dior-joy/1.avif,1,1,Dior Joy фото 1
dior-joy-by-dior-intense,import_images/dior-joy-by-dior-intense/1.avif,1,1,Dior Joy by Dior Intense фото 1
dior-miss-dior-absolutely-blooming,import_images/dior-miss-dior-absolutely-blooming/1.avif,1,1,Dior Miss Dior Absolutely Blooming фото 1
dior-miss-dior-blooming-bouquet,import_images/dior-miss-dior-blooming-bouquet/1.avif,1,1,Dior Miss Dior Blooming Bouquet фото 1
dior-miss-dior-cherie-eau-de-printemps,import_images/dior-miss-dior-cherie-eau-de-printemps/1.avif,1,1,Dior Miss Dior Cherie Eau de Printemps фото 1
dior-miss-dior-cherie-eau-de-toilette,import_images/dior-miss-dior-cherie-eau-de-toilette/1.avif,1,1,Dior Miss Dior Cherie Eau De Toilette фото 1
dior-miss-dior-cherie-leau,import_images/dior-miss-dior-cherie-leau/1.avif,1,1,Dior Miss Dior Cherie L`eau фото 1
dior-miss-dior-eau-de-parfum-2017,import_images/dior-miss-dior-eau-de-parfum-2017/1.avif,1,1,Dior Miss Dior Eau de Parfum 2017 фото 1
dior-miss-dior-eau-de-parfum-2021,import_images/dior-miss-dior-eau-de-parfum-2021/1.avif,1,1,Dior Miss Dior Eau de Parfum 2021 фото 1
dior-miss-dior-eau-de-toilette-2019,import_images/dior-miss-dior-eau-de-toilette-2019/1.avif,1,1,Dior Miss Dior Eau de Toilette 2019 фото 1
dior-miss-dior-originale,import_images/dior-miss-dior-originale/1.avif,1,1,Dior Miss Dior Originale фото 1
dior-poison,import_images/dior-poison/1.avif,1,1,Dior Poison фото 1
dior-poison-girl,import_images/dior-poison-girl/1.avif,1,1,Dior Poison Girl фото 1
dior-poison-girl-eau-de-toilette,import_images/dior-poison-girl-eau-de-toilette/1.avif,1,1,Dior Poison Girl Eau De Toilette фото 1
dior-poison-girl-unexpected,import_images/dior-poison-girl-unexpected/1.avif,1,1,Dior Poison Girl Unexpected фото 1
dior-poison-hypnotic,import_images/dior-poison-hypnotic/1.avif,1,1,Dior Hypnotic Poison фото 1
dior-poison-midnight,import_images/dior-poison-midnight/1.avif,1,1,Dior Poison Midnight фото 1
dior-poison-pure-elixir,import_images/dior-poison-pure-elixir/1.avif,1,1,Dior Poison Pure Elixir фото 1
